username,date,retweets,favorites,text,geo,mentions,hashtags,id,permalink
CervezaAguila,27/9/19 13:33,0,0,"Diego, ?ya fuiste a buscar en tu tienda mas cercana la Aguila Fusion Limon?",,,,1.18E+18,https://twitter.com/CervezaAguila/status/1177652478541750272
CervezaAguila,27/9/19 13:04,0,0,"Andy, tu # AguilaFusionLimon va en camino, ?participaste en nuestra actividad pa' boletas del Oktoberfest?",,,# AguilaFusionLimon,1.18E+18,https://twitter.com/CervezaAguila/status/1177645206067466240
razorblade446,27/9/19 12:55,1,0,"Nores @ BAVARIA_OFICIAL desde el sabado supuestamente"" me llegaba el beneficio de la # aguilafusionlimon AguilaFusion mensajero nunca aparecio o llamo para confrmar y cuando llama a atencion al cliente lo transfieren a otra linea y cuelgan @ sicsuper""@ BAVARIA_OFICIAL @ sicsuper# aguilafusionlimon",,@ BAVARIA_OFICIAL @ sicsuper,# aguilafusionlimon,1.18E+18,https://twitter.com/razorblade446/status/1177642883014434816
imfpdrz,27/9/19 12:19,1,1,Necesito probar un Aguila fusion limon para firmar mi salida oficial del alcohol.,,,,1.18E+18,https://twitter.com/imfpdrz/status/1177633834537492480
soy_delatorre,27/9/19 12:19,0,0,"Algo de frio, pero le tengo fe al sabado para probar mi # aguilafusionlimon",,,# aguilafusionlimon,1.18E+18,https://twitter.com/soy_delatorre/status/1177633824601186309
CervezaAguila,27/9/19 12:00,0,1,"Ronald, ?te encanto # AguilaFusionLimon?",,,# AguilaFusionLimon,1.18E+18,https://twitter.com/CervezaAguila/status/1177629036803235840
CervezaAguila,27/9/19 10:50,0,0,"Compadre, hoy es viernes y tu sabes que siempre empieza a dar sed. Ve por una # AguilaFusionLimon y nos cuentas como te va. ?O vas a decir que no quieres probarla?",,,# AguilaFusionLimon,1.18E+18,https://twitter.com/CervezaAguila/status/1177611532034809856
CervezaAguila,27/9/19 10:45,0,0,"Dani, es viernes, hoy es el dia perfecto para vernos y brindar con una # AguilaFusionLimon. ?Donde nos vemos?",,,# AguilaFusionLimon,1.18E+18,https://twitter.com/CervezaAguila/status/1177610257843064835
CervezaAguila,27/9/19 09:49,0,1,?Ya fueron por sus Aguila Fusion Limon?,,,,1.18E+18,https://twitter.com/CervezaAguila/status/1177596156064477184
CervezaAguila,27/9/19 09:38,0,0,"Kike, tendremos nuestro Distrito Fusion pa' disfrutes de la nueva # AguilaFusionLimon.",,,# AguilaFusionLimon,1.18E+18,https://twitter.com/CervezaAguila/status/1177593408082403331
CervezaAguila,27/9/19 09:13,0,1,"Total, !las palabras tienen poder!, por eso: este fin de semana Meli, se va a tomar una # AguilaFusionLimon, bien fria.",,,# AguilaFusionLimon,1.18E+18,https://twitter.com/CervezaAguila/status/1177587128496263171
CervezaAguila,27/9/19 09:12,0,0,"!Total!, las palabras tienen poder, por eso: este fin de semana Meli se va a tomar una # AguilaFusionLimon, bien fria.",,,# AguilaFusionLimon,1.18E+18,https://twitter.com/CervezaAguila/status/1177586854570401793
CervezaAguila,27/9/19 09:06,0,0,"!Lucesita, sin duda alguna! Cuentanos, ?ya probaste nuestra nueva # AguilaFusionLimon? !Esta imperdible!",,,# AguilaFusionLimon,1.18E+18,https://twitter.com/CervezaAguila/status/1177585419896184834
dxteban27,27/9/19 08:59,0,0,"Ole... Y definitivamente la gente de @ CervezaAguila se hicieron los pendejos con mi # aguilafusionlimon... Nunca me llego, ya que hptas.... Jartensela y que les sepa rico",,@ CervezaAguila,# aguilafusionlimon,1.18E+18,https://twitter.com/dxteban27/status/1177583522262982656
CervezaAguila,27/9/19 08:56,0,1,"Bro, entra a http://www.cervezaaguila.com y busca en nuestro mapa la tienda que te quede mas cerca. !Corre, que esa # AguilaFusionLimon esta imperdible!",,,# AguilaFusionLimon,1.18E+18,https://twitter.com/CervezaAguila/status/1177582884162588672
BRANDUCHO,26/9/19 22:45,0,0,"Cerveza aguila fusion limon. Que mas sigue, cerveza aguila con cristales de Sabila y extracto de guarana?",,,,1.18E+18,https://twitter.com/BRANDUCHO/status/1177428915821907968
KELGRAAL,26/9/19 22:19,0,0,Que tal esa aguila fusion limon ?,,,,1.18E+18,https://twitter.com/KELGRAAL/status/1177422589591007235
Buri1927,26/9/19 21:32,1,4,Lleeeegooooooo # aguilafusionlimon vamos a ver que tal esto pic.twitter.com/PsxqQPKA5y,,,# aguilafusionlimon,1.18E+18,https://twitter.com/Buri1927/status/1177410721585475584
Ogomescasseres,26/9/19 21:15,0,3,Que ganas de una canasta de aguila fusion limon en botella,,,,1.18E+18,https://twitter.com/Ogomescasseres/status/1177406280060850176
djtavo32,26/9/19 17:56,0,0,@ CervezaAguila Quiero ir # AguilaFusionLimon # CervezaAguila # Oktoberfest,,@ CervezaAguila,# AguilaFusionLimon # CervezaAguila # Oktoberfest,1.18E+18,https://twitter.com/djtavo32/status/1177356385467674625
Dianausugalm,26/9/19 17:25,0,0,Yoya que nisiquiera pude tener mi aguila fusion limon porque en Medellin nunca habian,,,,1.18E+18,https://twitter.com/Dianausugalm/status/1177348380365918209
CervezaAguila,26/9/19 17:10,0,1,"No, esa fusion solo podria ser superada por un diomedazo con una # AguilaFusionLimon.",,,# AguilaFusionLimon,1.18E+18,https://twitter.com/CervezaAguila/status/1177344748232826880
CervezaAguila,26/9/19 16:28,9,28,"Primero # AguilaFusionLimon, y ahora @ shakira ft. @ jlo, otra muestra mas de que las buenas fusiones existen. !Que orgullo ver a una colombiana en el # SuperBowlLIV! https://twitter.com/NFL/status/1177308865475407872 ...",,@ shakira @ jlo,# AguilaFusionLimon # SuperBowlLIV,1.18E+18,https://twitter.com/CervezaAguila/status/1177334026694201361
hilmerxavi,26/9/19 16:27,0,0,"Quiero la boleta para probar la Cerveza Aguila Fusion Limon, cerveza Aguila"" la mas antigua Cerveza de Barranquilla.""",,,,1.18E+18,https://twitter.com/hilmerxavi/status/1177333973413957638
docleito,26/9/19 14:52,0,0,SERVICIO A.A Cerveza Aguila anuncia su mas reciente innovacion: Aguila Fusion Limon Y yo aca aun espero la cerveza de espirulina!!!!!!!,,,,1.18E+18,https://twitter.com/docleito/status/1177310021291524097
CervezaAguila,26/9/19 11:09,0,0,"Kathe, no sabes como nos alegra el alma saber que te gusto nuestra # AguilaFusionLimon. !Vivela y disfrutala siempre fria!",,,# AguilaFusionLimon,1.18E+18,https://twitter.com/CervezaAguila/status/1177253964125003776
andreabg_08,26/9/19 10:42,0,0,Que ganas de probar una aguila fusion limon ahora mismo.,,,,1.18E+18,https://twitter.com/andreabg_08/status/1177246955166162945
CervezaAguila,26/9/19 10:14,0,0,"Tatto ?te reuniste con Ana?, # AguilaFusionLimon, esta pa' acompanarlos en todo momento.",,,# AguilaFusionLimon,1.18E+18,https://twitter.com/CervezaAguila/status/1177239997717602306
CervezaAguila,26/9/19 09:53,0,0,"Calma bro, aun las botellas de # AguilaFusionLimon se siguen entregando, pronto podras tenerla en tus manos.",,,# AguilaFusionLimon,1.18E+18,https://twitter.com/CervezaAguila/status/1177234829278089216
ITURRIAGOISAAC,26/9/19 09:50,0,1,"Salio al mercado Cerveza aguila fusion limon. Que mas sigue, cerveza aguila con cristales de Sabila y extracto de guarana?",,,,1.18E+18,https://twitter.com/ITURRIAGOISAAC/status/1177233915502825472
AlNuz,26/9/19 09:47,0,1,Ya que me acorde... Cosas feas y esa nueva cerveza de # aguilafusionlimon,,,# aguilafusionlimon,1.18E+18,https://twitter.com/AlNuz/status/1177233316027817984
CervezaAguila,26/9/19 09:47,0,1,"Nos gusta pensar en todos, tu sabes como somos nosotros. ?Vamos hoy por una # AguilaFusionLimon?",,,# AguilaFusionLimon,1.18E+18,https://twitter.com/CervezaAguila/status/1177233305063841792
CervezaAguila,26/9/19 08:13,0,2,"Aldana, claro que cumplimos. ?Te gusto nuestra # AguilaFusionLimon? Deliciosa, ?verdad?",,,# AguilaFusionLimon,1.18E+18,https://twitter.com/CervezaAguila/status/1177209625822842881
Sagoatehortua,25/9/19 22:47,0,0,"Yo no se si sere muy basico pa las polas o que, pero lo que es esa aguila fusion limon me tomaria maso 10 de ellas por dia.",,,,1.18E+18,https://twitter.com/Sagoatehortua/status/1177067187426734082
lamunera_,25/9/19 22:19,0,0,Quiero quiero ir al Oktoberfest por que ademas a toda bogota le dieron su Aguila fusion limon y ami no,,,,1.18E+18,https://twitter.com/lamunera_/status/1177060016207081473
Luchofer19641,25/9/19 21:27,0,0,Claro y catar la nueva aguila fusion limon,,,,1.18E+18,https://twitter.com/Luchofer19641/status/1177046973515481089
Paula_moreno15,25/9/19 21:24,0,7,si vamos por una aguila fusion Limon.,,,,1.18E+18,https://twitter.com/Paula_moreno15/status/1177046147866812416
Tefyarciniegas,25/9/19 21:15,0,0,Creo q me las merezco por tanta espera de mi nueva aguila fusion limon ! Por q aun no llega,,,,1.18E+18,https://twitter.com/Tefyarciniegas/status/1177044023971844098
aleparra23,25/9/19 20:48,1,4,Creo que voy a ser la ultima en probar la aguila light fusion limon que rabia.,,,,1.18E+18,https://twitter.com/aleparra23/status/1177037248832909314
Hum_Alien,25/9/19 17:53,1,15,"Salio al mercado Cerveza aguila fusion limon. Que mas sigue, cerveza aguila con cristales de Sabila y extracto de guarana?",,,,1.18E+18,https://twitter.com/Hum_Alien/status/1176993106190852096
SoyLuguin,25/9/19 16:13,0,1,"Hola amigos @ CervezaAguila Hace unas semanas me gane una cerveza Aguila Fusion Limon y estaba muy feliz!! Pero es el momento en el que no me ha llegado, esta situacion tambien pasa con unos amigos, se refundieron esas botellas camino a nuestro destino",,@ CervezaAguila,,1.18E+18,https://twitter.com/SoyLuguin/status/1176968048542146560
johanavalenxia,25/9/19 15:37,0,0,Oktoberfest # AguilaFusionLimon yo quiero boletas,,,# AguilaFusionLimon,1.18E+18,https://twitter.com/johanavalenxia/status/1176958982323417095
kabp8,25/9/19 14:34,0,1,Cuenta la historia que habia perdido toda esperanza en que llegara mi # AguilaFusionLimon hasta que !Taran! Gracias @ CervezaAguila pic.twitter.com/0vgYoNviTY,,@ CervezaAguila,# AguilaFusionLimon,1.18E+18,https://twitter.com/kabp8/status/1176943060439224320
_camilohoyos,25/9/19 13:36,0,0,Regalame unas ya que nunca llego la cerveza # aguilafusionlimon que me prometieron. Con eso me contentan.,,,# aguilafusionlimon,1.18E+18,https://twitter.com/_camilohoyos/status/1176928520565604352
CervezaAguila,25/9/19 12:05,0,0,Que felicidad ta amarilla saber que ya tienes tu # AguilaFusionLimon. !Vivela y gozatela!,,,# AguilaFusionLimon,1.18E+18,https://twitter.com/CervezaAguila/status/1176905537662980097
george10041,25/9/19 11:37,0,0,La verdad .. verdad..!!! Esta cerveza fusion limon...nah nah....!!! Nada que ver !!! Prefiero la tradicional.... incluso la aguila light...tiene mas sabor que esta!! ..no me gusto,,,,1.18E+18,https://twitter.com/george10041/status/1176898613592698880
CervezaAguila,25/9/19 10:41,0,0,"Andre, sabemos lo ansiosa que estas por probar nuestra # AguilaFusionLimon. Te pedimos un poquito mas de paciencia. Aun estamos en proceso de entrega.",,,# AguilaFusionLimon,1.18E+18,https://twitter.com/CervezaAguila/status/1176884493543792642
CervezaAguila,25/9/19 09:30,0,1,"MileToroP, que esperas para pedir tu # AguilaFusionLimon por http://rappi.com .",,,# AguilaFusionLimon,1.18E+18,https://twitter.com/CervezaAguila/status/1176866667877601282
CervezaAguila,25/9/19 08:49,0,1,"Nos alegra un monton saber que ya tienes nuestra # AguilaFusionLimon. Buenisima, ?verdad?",,,# AguilaFusionLimon,1.18E+18,https://twitter.com/CervezaAguila/status/1176856222332571649
CervezaAguila,25/9/19 08:33,0,0,"!Anthony, calma mi hermano! Aun estamos en proceso de entrega. La tuya llegara en menos de los que te imaginas. Ve preparando la llegada de nuestra # AguilaFusionLimon.",,,# AguilaFusionLimon,1.18E+18,https://twitter.com/CervezaAguila/status/1176852173239586817
CervezaAguila,25/9/19 07:04,0,0,"Vale, sin duda alguna. No lo dudes ni un segundo. Tienes que probar nuestra # AguilaFusionLimon. Esta sencillamente espectacular.",,,# AguilaFusionLimon,1.18E+18,https://twitter.com/CervezaAguila/status/1176829938458124289
MariaCMendozaV,25/9/19 03:08,8,7,Se pueden meter su Aguila fusion limon por el culo,,,,1.18E+18,https://twitter.com/MariaCMendozaV/status/1176770462405337088
Camila_Arandia,24/9/19 23:21,0,0,Lo siento pero odie esa Aguila fusion limon. Que mierda tan fea.,,,,1.18E+18,https://twitter.com/Camila_Arandia/status/1176713234063212547
CervezaAguila,24/9/19 20:43,0,0,Y nosotros amamos poder brindar contigo y darle mas sabor a tu vida. # AguilaFusionLimon.,,,# AguilaFusionLimon,1.18E+18,https://twitter.com/CervezaAguila/status/1176673454927634432
fabrixioriko,24/9/19 20:42,0,0,Me imagino que el Aguila limon sabe a verga y por eso les encanta. # aguilafusionlimon,,,# aguilafusionlimon,1.18E+18,https://twitter.com/fabrixioriko/status/1176673391211876353
CervezaAguila,24/9/19 19:42,0,0,Ahi es cuando te quitas los zapatos y te relajas con el sabor de # AguilaFusionLimon.,,,# AguilaFusionLimon,1.18E+18,https://twitter.com/CervezaAguila/status/1176658254388183042
sbc2098,24/9/19 18:57,0,4,"Dicen que no hay que esperar nada de nadie, pero yo espero que la Aguila fusion limon no me falle.",,,,1.18E+18,https://twitter.com/sbc2098/status/1176646876885598208
ed_bundy,24/9/19 17:45,0,0,Me llego la nueva Aguila Fusion. ?Ya soy puedo ser influenciador? # AguilaFusionLimon @ CervezaAguilapic.twitter.com/4enchoQOo9,,@ CervezaAguilapic,# AguilaFusionLimon,1.18E+18,https://twitter.com/ed_bundy/status/1176628703612350464
CervezaAguila,24/9/19 17:24,0,0,"Es muy facil viejo Vic, en este link aparecen todos los puntos de venta de Aguila Fusion Limon: https://bit.ly/2lXjhXo , ve ahora por la tuya.",,,,1.18E+18,https://twitter.com/CervezaAguila/status/1176623410643951617
CervezaAguila,24/9/19 16:17,1,0,"Se te tiene Aguila Original, Aguila Light, Aguila Cero o # AguilaFusionLimon. Las opciones estan listas Ana.",,,# AguilaFusionLimon,1.18E+18,https://twitter.com/CervezaAguila/status/1176606561449521157
CervezaAguila,24/9/19 14:58,1,1,"Hola bro, sabes que andamos en modo fusion verdad... Esto puede llegar a funcionar mas adelante, pero mientras llega podemos brindar con una # AguilaFusionLimon, ?que te parece?",,,# AguilaFusionLimon,1.18E+18,https://twitter.com/CervezaAguila/status/1176586851223769089
CervezaAguila,24/9/19 14:10,0,0,"Pipe, tienes toda la razon, ?ya probaste # AguilaFusionLimon?",,,# AguilaFusionLimon,1.18E+18,https://twitter.com/CervezaAguila/status/1176574722504581125
sebastianpasto4,24/9/19 13:17,0,0,"Ninguno, son un fraude, me mandan un mensaje diciendo que mi aguila fusion limon ya viene en camino y cuando entro al Link me sale que ya caduco y no me llega nada... pic.twitter.com/tFtSPMi8yW",,,,1.18E+18,https://twitter.com/sebastianpasto4/status/1176561229428658178
CervezaAguila,24/9/19 11:49,0,1,"Poetadcortadera, ?fusionaste la nueva # AguilaFusionLimon con tu comida preferida?",,,# AguilaFusionLimon,1.18E+18,https://twitter.com/CervezaAguila/status/1176539085026017282
CervezaAguila,24/9/19 10:56,0,0,"Karen, si ganaste tu botella, creeme que va a llegar, pendiente porque en un abrir y cerrar de ojos, # AguilaFusionLimon, estara timbrando en tu casa.",,,# AguilaFusionLimon,1.18E+18,https://twitter.com/CervezaAguila/status/1176525788855832576
CervezaAguila,24/9/19 10:54,0,0,"Liceth, ?ya viviste la sabrosura de Aguila Fusion Limon?",,,,1.18E+18,https://twitter.com/CervezaAguila/status/1176525305189732353
CervezaAguila,24/9/19 10:03,0,1,"Ya veras que valio la pena esperarla, y recuerda que # AguilaFusionLimon se debe tomar bien fria.",,,# AguilaFusionLimon,1.18E+18,https://twitter.com/CervezaAguila/status/1176512399521779712
CervezaAguila,24/9/19 09:57,0,0,"Esa es la actitud, aqui: https://bit.ly/2kOZXLT pueden encontrar todos los puntos de venta. !Una # AguilaFusionLimon espera por ustedes!",,,# AguilaFusionLimon,1.18E+18,https://twitter.com/CervezaAguila/status/1176511078207021056
Consuelo7410,24/9/19 09:37,0,0,Para el 30 de septiembre mi cumpleanos # aguilafusionlimon,,,# aguilafusionlimon,1.18E+18,https://twitter.com/Consuelo7410/status/1176506010418253824
CervezaAguila,24/9/19 08:55,0,1,"!Esa es Clau!, ?pa' cuando es la cita con el combo para disfrutar de # AguilaFusionLimon?",,,# AguilaFusionLimon,1.18E+18,https://twitter.com/CervezaAguila/status/1176495368730791936
CervezaAguila,24/9/19 08:54,0,0,"Hola Vic, ?ya probaste # AguilaFusionLimon?",,,# AguilaFusionLimon,1.18E+18,https://twitter.com/CervezaAguila/status/1176495027666726913
soy_delatorre,24/9/19 08:38,0,1,Por fin llego mi # aguilafusionlimon gracias :) pic.twitter.com/6JDkK9StjH,,,# aguilafusionlimon,1.18E+18,https://twitter.com/soy_delatorre/status/1176490989197959169
CervezaAguila,24/9/19 07:25,0,1,"Viejo Jose, esa era la idea que te contagiaras del nuevo sabor # AguilaFusionLimon.",,,# AguilaFusionLimon,1.18E+18,https://twitter.com/CervezaAguila/status/1176472829472256002
_DanielGR_,23/9/19 23:04,0,2,"Esa nueva Aguila fusion limon"" esta una mierda.""",,,,1.18E+18,https://twitter.com/_DanielGR_/status/1176346700287488010
CervezaAguila,23/9/19 21:57,0,1,"Si Manu, en este link:https://bit.ly/2kJPtxl encontraras todos los puntos de venta de Aguila Fusion Limon.",,,,1.18E+18,https://twitter.com/CervezaAguila/status/1176329679546068993
Camo__Oficial,23/9/19 20:08,0,0,Ya saben.. si necesitan un corresponsal en el partido del domingo de la Mechita.. me dicen.. con gusto voy y reporto todas las emociones.. y despues salimos a celebrar!!! . # AguilaFusionLimon.,,,# AguilaFusionLimon,1.18E+18,https://twitter.com/Camo__Oficial/status/1176302372915679233
CervezaAguila,23/9/19 20:06,0,1,"Pues vamos pa' la tienda a celebrar mi bro, nada perdemos con ir, y si ganamos mucho probando y brindando. # AguilaFusionLimon.",,,# AguilaFusionLimon,1.18E+18,https://twitter.com/CervezaAguila/status/1176301900335108097
CervezaAguila,23/9/19 19:51,0,0,"Relajado Andy, no te vas a quedar sin probar # AguilaFusionLimon, a veces exprimir limones hace que nos tardemos un poco, pero siempre cumplimos.",,,# AguilaFusionLimon,1.18E+18,https://twitter.com/CervezaAguila/status/1176298160970489856
CervezaAguila,23/9/19 19:48,0,0,"No digas eso Miss, # AguilaFusionLimon tiene ese toquesito de limon que te hacia falta, vuelve a probarla y veras.",,,# AguilaFusionLimon,1.18E+18,https://twitter.com/CervezaAguila/status/1176297219370246156
CervezaAguila,23/9/19 19:33,0,0,"Hola bro, ten clama, lo bueno siempre tarda un poco en llegar. Ya muchos colombianos han probado # AguilaFusionLimon y les encanto, no te vas a quedar sin probarla.",,,# AguilaFusionLimon,1.18E+18,https://twitter.com/CervezaAguila/status/1176293543024967683
CervezaAguila,23/9/19 19:15,0,1,"Hola Teffy, ya pronto estara llegando, veras que el sabor de # AguilaFusionLimon va a generar son puras ganas unirnos y celebrar todos juntos, una guerra jamas.",,,# AguilaFusionLimon,1.18E+18,https://twitter.com/CervezaAguila/status/1176288889839005697
ricardo_niebles,23/9/19 19:11,0,1,"En @ tukavacartagena tenemos aguardiente tapa verde, y aguila ligth fusion. Ambos traen limon, pero podemos ponerle mas limon y en una noche te curamos.",,@ tukavacartagena,,1.18E+18,https://twitter.com/ricardo_niebles/status/1176288053092081664
CervezaAguila,23/9/19 19:10,0,1,"Dale con todo viejo Rafa, ya veras que la segunda oportunidad valdra la pena. # AguilaFusionLimon.",,,# AguilaFusionLimon,1.18E+18,https://twitter.com/CervezaAguila/status/1176287734316453888
CervezaAguila,23/9/19 18:47,0,0,"Viejo Cami, queremos saber si ya te llego tu botella de # AguilaFusionLimon. !Estamos en la jugada!",,,# AguilaFusionLimon,1.18E+18,https://twitter.com/CervezaAguila/status/1176281938400808960
CervezaAguila,23/9/19 18:43,0,1,"Relax viejo Jaco, aca solo queremos presentarte a la nueva de la familia, # AguilaFusionLimon llega con un buen sabor, prueba y veras.",,,# AguilaFusionLimon,1.18E+18,https://twitter.com/CervezaAguila/status/1176281000902635520
arturovargasm,23/9/19 15:06,0,1,"Muy, muy rica!!! Esta # AguilaFusionLimon de @ cervezaaguila es un hit. Hay que tomarla bien fria (como se debe tomar la cerveza) y el sabor a limon esta en su punto ideal. Exquisita. en... https://www.instagram.com/p/B2xDtzdAyovZz4vb5-Mw1Rpf4fS0t4zZjDlyEI0/?igshid=3ld3tnqg2voq ...",,@ cervezaaguila,# AguilaFusionLimon,1.18E+18,https://twitter.com/arturovargasm/status/1176226435117326337
Marysol1018,23/9/19 14:41,0,0,Muy feliz # aguilafusionlimon @ CervezaAguila pic.twitter.com/W2hMHKCvte,,@ CervezaAguila,# aguilafusionlimon,1.18E+18,https://twitter.com/Marysol1018/status/1176219936479490048
CervezaAguila,23/9/19 10:46,0,0,"Es la fusion que necesitaba tu vida, pal' frio o pal' calor # AguilaFusionLimon.",,,# AguilaFusionLimon,1.18E+18,https://twitter.com/CervezaAguila/status/1176160997968662529
CervezaAguila,23/9/19 10:23,0,0,"?Que te parece guacala Necci?, para que se te quite esa sensacion, prueba # AguilaFusionLimon fria.",,,# AguilaFusionLimon,1.18E+18,https://twitter.com/CervezaAguila/status/1176155086705319937
Alelicious_,23/9/19 10:13,0,1,Jajajaja Pato Aguila Fusion limon la venden aca cerca y la otra si ni ideaaa,,,,1.18E+18,https://twitter.com/Alelicious_/status/1176152497209118723
pathico23,23/9/19 10:11,0,0,Por favor una aguila fusion limon y una pokerita (no las he conseguido por ningun lado ),,,,1.18E+18,https://twitter.com/pathico23/status/1176152136041844736
stiven_90,22/9/19 23:26,0,0,@ cervezaaguila actualizandose con # aguilaFusionLimon https://www.instagram.com/p/B2vYHcrjRH0/?igshid=a5sqjsmf83au ...,,@ cervezaaguila,# aguilaFusionLimon,1.18E+18,https://twitter.com/stiven_90/status/1175989822772539393
Arce9726,22/9/19 22:58,0,0,Esa aguila fusion limon que cosa tan sambrosa hermano,,,,1.18E+18,https://twitter.com/Arce9726/status/1175982684318965761
JaquelinLopezR,22/9/19 22:07,0,0,"Hay cosas que me decepcionan en esta vida, como el aguila fusion limon! Jjajajajaja siempre espero demasiado de todo. pic.twitter.com/IrhyHJbp5b",,,,1.18E+18,https://twitter.com/JaquelinLopezR/status/1175969808942272512
anggieliiceth,22/9/19 21:34,0,2,Que ganas de una aguila fusion limon.,,,,1.18E+18,https://twitter.com/anggieliiceth/status/1175961568808452109
KarlaLove_CE,22/9/19 21:12,0,0,Probandoooo # aguilafusionlimon jajajja omeeee pic.twitter.com/galZNjcoQ5,,,# aguilafusionlimon,1.18E+18,https://twitter.com/KarlaLove_CE/status/1175955992275824641
ASurvivorSoul,22/9/19 21:07,0,4,"en busqueda de la aguila fusion limon y no la encontramos, bueno si pero estaba caliente joda",,,,1.18E+18,https://twitter.com/ASurvivorSoul/status/1175954918324297728
cdelahoz,22/9/19 20:02,0,0,Me gusto mucho # aguilafusionlimon gracias @ CervezaAguila,,@ CervezaAguila,# aguilafusionlimon,1.18E+18,https://twitter.com/cdelahoz/status/1175938503198302208
ale_cg98,22/9/19 16:38,0,3,Esa aguila fusion limon es horrible ush # SiemprePokeronaNuncaInpokerona,,,# SiemprePokeronaNuncaInpokerona,1.18E+18,https://twitter.com/ale_cg98/status/1175887062979006464
Kenai_6,22/9/19 14:23,0,0,Aguila fusion limon o miedo?,,,,1.18E+18,https://twitter.com/Kenai_6/status/1175853200588640256
Bismark_BM,22/9/19 13:09,0,0,"?Ya probaron la nueva # AguilaFusionLimon? No soy amante de cervezas, pero puedo atestar que esta es DELICIOSA. Perfecta para los # Emmys2019 Aparentemente tuve suerte, porque compre el ultimo # SixPack del supermercado local. Apenas salio al mercado la semana pasada y ya se agotopic.twitter.com/4WnciOtjti",,,# AguilaFusionLimon # Emmys2019 # SixPack,1.18E+18,https://twitter.com/Bismark_BM/status/1175834455602319361
notengovenereas,22/9/19 13:03,0,5,"Hola @ CervezaAguila quiero poner una queja formal ya que el dia de ayer tome una de las peores decisiones de mi vida. Por simple curiosidad probe una de sus cervezas Aguila fusion Limon y mis pechos empezaron a crecer y mi pene perdio su tamano, exijo una indemnizacion.",,@ CervezaAguila,,1.18E+18,https://twitter.com/notengovenereas/status/1175832936807096320
CervezaAguila,22/9/19 12:43,0,0,"Bro, me imagino que nuestra # AguilaFusionLimon hara desde ahora en adelante parte de tus momentos mas especiales, ?verdad?",,,# AguilaFusionLimon,1.18E+18,https://twitter.com/CervezaAguila/status/1175827890446983168
AntonioJosVarg3,22/9/19 12:32,0,1,"Se me parece a la cerveza bahia pero con diferente nombre, es mucho mas sabroso extraer el sumo del limon en el momento del consumo, estos saborizantes ademas de perjudiciales no dan el mismo sabor. # AguilaFusionLimon",,,# AguilaFusionLimon,1.18E+18,https://twitter.com/AntonioJosVarg3/status/1175825301722619904
CervezaAguila,22/9/19 12:30,0,1,"Maria, nosotros tambien te amamos. ?Ya probaste nuestra # AguilaFusionLimon para celebrar el amor y la amistad?",,,# AguilaFusionLimon,1.18E+18,https://twitter.com/CervezaAguila/status/1175824707788189696
CervezaAguila,22/9/19 10:52,0,0,"Bro, ?como te fue con nuestra # AguilaFusionLimon? Me imagino que no dejaste ni una gota en esa botella.",,,# AguilaFusionLimon,1.18E+18,https://twitter.com/CervezaAguila/status/1175800147890069507
CervezaAguila,22/9/19 09:58,0,0,"Pipe, tus datos solo los tenemos para hacerte llegar esa fusion tan bacana de # AguilaFusionLimon, pendiente porque esa botella ya va en camino.",,,# AguilaFusionLimon,1.18E+18,https://twitter.com/CervezaAguila/status/1175786387041390593
CervezaAguila,22/9/19 09:54,0,1,"Fabi, deja el afan porque en menos de lo que esperas, # AguilaFusionLimon estara timbrando en tu casa.",,,# AguilaFusionLimon,1.18E+18,https://twitter.com/CervezaAguila/status/1175785499384045569
CervezaAguila,22/9/19 09:48,0,1,"Cris, nos alegra que seas parte de esta familia Aguila, pero cuentame ?ya probaste nuestra nueva # AguilaFusionLimon? Esta riquisima, como para no dejar ni una gota en esa botella.",,,# AguilaFusionLimon,1.18E+18,https://twitter.com/CervezaAguila/status/1175784000016834560
CervezaAguila,22/9/19 09:44,0,0,"Majo nuestra # AguilaFusionLimon es tan tierna como tu. Disfruta y vive esta espectacular fusion, hecha especialmente para ti.",,,# AguilaFusionLimon,1.18E+18,https://twitter.com/CervezaAguila/status/1175782880104112135
CervezaAguila,22/9/19 09:35,0,0,"Mari, ?ya la probaste? Sino lo has hecho corre por la tuya. Nuestra # AguilaFusionLimon esta imperdible.",,,# AguilaFusionLimon,1.18E+18,https://twitter.com/CervezaAguila/status/1175780582716006402
