username,date,retweets,favorites,text,geo,mentions,hashtags,id,permalink
OsakaTheVictim,9/9/19 09:12,0,0,"Soy de la vieja escuela, solo me gustan las aguilas negras (las cervezas, ojo con eso) # AguilaFusionLimon",,,# AguilaFusionLimon,1.17E+18,https://twitter.com/OsakaTheVictim/status/1171063946981314560
Kliche_Arboleda,9/9/19 09:09,0,0,La sigo esperando que llegue a la casa # AguilaFusionLimon,,,# AguilaFusionLimon,1.17E+18,https://twitter.com/Kliche_Arboleda/status/1171063003632013318
soy_delatorre,9/9/19 09:05,0,1,Aun la espero locamente # AguilaFusionLimon,,,# AguilaFusionLimon,1.17E+18,https://twitter.com/soy_delatorre/status/1171062065353674753
AdalbertoNarvae,9/9/19 08:59,0,0,Cuando puedo probarla en Cali # AguilaFusionLimon,,,# AguilaFusionLimon,1.17E+18,https://twitter.com/AdalbertoNarvae/status/1171060574094057472
josevillarrealc,9/9/19 08:59,0,0,"Ombe, debe tomarse bien fria porqie apenas baje temp sabe a alkaselter#AguilaFusionLimon",,,,1.17E+18,https://twitter.com/josevillarrealc/status/1171060448474673153
GaboRojas_,9/9/19 08:48,0,1,# aguilafusionlimon @ CervezaAguila No llego la mia,,@ CervezaAguila,# aguilafusionlimon,1.17E+18,https://twitter.com/GaboRojas_/status/1171057844680048646
ANDRESPAEZRZ8,9/9/19 08:44,0,1,merezco que me envien 2 # aguilafusionlimon me han fallado,,,# aguilafusionlimon,1.17E+18,https://twitter.com/ANDRESPAEZRZ8/status/1171056821303484416
TovarPeriodista,9/9/19 08:44,0,0,"# AguilaFusionLimon no la he probado, deberian enviarme una a la casa para darle el visto bueno @ CervezaAguila",,@ CervezaAguila,# AguilaFusionLimon,1.17E+18,https://twitter.com/TovarPeriodista/status/1171056676700590080
JEAM_79v2,9/9/19 08:43,25,55,"# AguilaFusionLimon # NuestrosDeportistas # FelizLunes # LaWPolariza # SiFueraAlcalde # PicoYPlaca Felix de Bedout, Daniel Coronell, Yamid Amat, la Duzan, Matador y los de la W cuando siembran su libre expresion"" y no les gusta lo q cosechan # DescripcionGraficapic.twitter.com/LQZW9hHsES""",,,# AguilaFusionLimon # NuestrosDeportistas # FelizLunes # LaWPolariza # SiFueraAlcalde # PicoYPlaca # DescripcionGraficapic,1.17E+18,https://twitter.com/JEAM_79v2/status/1171056531388993536
oscarcanchila,9/9/19 08:36,0,0,Nunca llego # AguilaFusionLimon,,,# AguilaFusionLimon,1.17E+18,https://twitter.com/oscarcanchila/status/1171054841877139456
TowersChristian,9/9/19 08:36,0,0,"Maaaala con ganas, le falta sabor. # AguilaFusionLimon",,,# AguilaFusionLimon,1.17E+18,https://twitter.com/TowersChristian/status/1171054668035870720
GabraWong,9/9/19 08:25,0,0,# AguilaFusionLimon Me gustaria probarla,,,# AguilaFusionLimon,1.17E+18,https://twitter.com/GabraWong/status/1171052013079187457
sebas10casti,9/9/19 08:19,0,4,# AguilaFusionLimon lo peor que he tomado en mi vida y si que he tomado cosas horribles en mi vida.,,,# AguilaFusionLimon,1.17E+18,https://twitter.com/sebas10casti/status/1171050380974841857
hoyosmariana94,9/9/19 07:43,0,0,"Aun no, por que no ha llegado la que dizque  me gane "" @ CervezaAguila # AguilaFusionLimon""",,@ CervezaAguila,# AguilaFusionLimon,1.17E+18,https://twitter.com/hoyosmariana94/status/1171041488861585410
aldoguti92,9/9/19 07:29,0,2,# AguilaFusionLimon Deliciosa,,,# AguilaFusionLimon,1.17E+18,https://twitter.com/aldoguti92/status/1171037980955488256
luismiranda_1,9/9/19 07:16,0,0,"# AguilaFusionLimon ya la probe gracias a la cortesia de @ CervezaAguila. Es una buena mezcla para los que quieran algo diferente. De todos modos yo me quedo con mi Original, esa que es Sin Igual y Siempre Igual.",,@ CervezaAguila,# AguilaFusionLimon,1.17E+18,https://twitter.com/luismiranda_1/status/1171034707800338435
Franklin_101010,9/9/19 07:13,0,0,# AguilaFusionLimon publicidad falta nunca me llego mi @ CervezaAguila los voy a denunciar en la @ sicsuper,,@ CervezaAguila @ sicsuper,# AguilaFusionLimon,1.17E+18,https://twitter.com/Franklin_101010/status/1171033787859386368
cervetariana,9/9/19 07:12,2,13,# AguilaFusionLimon excelente pic.twitter.com/p54RY1G1ae,,,# AguilaFusionLimon,1.17E+18,https://twitter.com/cervetariana/status/1171033601581965317
LaMaria_92,9/9/19 07:03,0,0,!DELIIIIIIIIIIIIII! # AguilaFusionLimon,,,# AguilaFusionLimon,1.17E+18,https://twitter.com/LaMaria_92/status/1171031487258484738
ANDRESPAEZRZ8,9/9/19 06:53,1,14,Y nada que me llega mi # AguilaFusionLimon @ CervezaAguilapic.twitter.com/2MeE9fp95B,,@ CervezaAguilapic,# AguilaFusionLimon,1.17E+18,https://twitter.com/ANDRESPAEZRZ8/status/1171028907044286469
Humo_Vinotinto,9/9/19 06:43,0,1,La # AguilaFusionLimon sabe a acidos gastricos !,,,# AguilaFusionLimon,1.17E+18,https://twitter.com/Humo_Vinotinto/status/1171026352302166016
diogenes226,9/9/19 06:39,0,0,"# aguilafusionlimon !VACAS SAGRADAS, QUE ABUSAN DEL PODER EN COLOMBIA! !Los grandes tambien mueren! Muy grandes y importantes, pero tambien mueren: - Gaitan, Hurtado, Lleras, Lopez, Pastrana... - Dictadores, como: Hitler, Stalin, Pinochet, Castro... - Hoy le toco a CAMILO SESTO",,,# aguilafusionlimon,1.17E+18,https://twitter.com/diogenes226/status/1171025317663858693
Stefi_Fandi,9/9/19 06:34,0,0,# AguilaFusionLimon Me parecio deliciosa.,,,# AguilaFusionLimon,1.17E+18,https://twitter.com/Stefi_Fandi/status/1171023970071646208
T4TTQ,9/9/19 06:19,0,0,Sigo esperando # AguilaFusionLimon,,,# AguilaFusionLimon,1.17E+18,https://twitter.com/T4TTQ/status/1171020351633014784
RubenRo28494193,9/9/19 06:17,0,0,# AguilaFusionLimon de verdad q se fajaron es excelente la mezcla entre lo rico del aguila y lo amarguito del limon es perfecta que siga la # Sabrosura,,,# AguilaFusionLimon # Sabrosura,1.17E+18,https://twitter.com/RubenRo28494193/status/1171019697002819584
hectorinrodrig1,9/9/19 06:15,0,0,# AguilaFusionLimon El alcohol es nocivo para la salud.,,,# AguilaFusionLimon,1.17E+18,https://twitter.com/hectorinrodrig1/status/1171019400935280640
pejota29,9/9/19 06:04,0,0,Me parecio deliciosa # AguilaFusionLimon,,,# AguilaFusionLimon,1.17E+18,https://twitter.com/pejota29/status/1171016539518226432
bastardx0,9/9/19 05:55,0,1,No la he probado...Tengo la esperanza de que me llegue algun dia a la casa :))) salu2. # AguilaFusionLimon https://twitter.com/CervezaAguila/status/1170924794184908801 ...,,,# AguilaFusionLimon,1.17E+18,https://twitter.com/bastardx0/status/1171014150715256832
CervezaAguila,9/9/19 05:45,6,35,?Ya la probaste? Cuentanos usando el # AguilaFusionLimon pic.twitter.com/WbhxOnwOLG,,,# AguilaFusionLimon,1.17E+18,https://twitter.com/CervezaAguila/status/1171011615874895873
UnFelipeDice,9/9/19 05:35,0,3,Me podrian decir donde carajos la encuentrooooo! @ CervezaAguila # AguilaFusionLimon,,@ CervezaAguila,# AguilaFusionLimon,1.17E+18,https://twitter.com/UnFelipeDice/status/1171009135351144448
ANDREAZAPATAF,9/9/19 05:33,0,0,# AguilaFusionLimon Tengo que probarla pronto,,,# AguilaFusionLimon,1.17E+18,https://twitter.com/ANDREAZAPATAF/status/1171008832945971200
e5ae0a020f954d3,9/9/19 01:26,0,0,# AguilaFusionLimon deliciosa,,,# AguilaFusionLimon,1.17E+18,https://twitter.com/e5ae0a020f954d3/status/1170946628431306753
hayderperez,9/9/19 01:15,0,2,"Cerveza Aguila cual sabor, si nunca me llego # AguilaFusionLimon @ CervezaAguila",,@ CervezaAguila,# AguilaFusionLimon,1.17E+18,https://twitter.com/hayderperez/status/1170943837021331456
afro_candombera,9/9/19 00:39,0,0,# AguilaFusionLimon es el reemplazo de reds?,,,# AguilaFusionLimon,1.17E+18,https://twitter.com/afro_candombera/status/1170934851236765696
Paca__Gartee,9/9/19 00:24,0,1,"Me muero por probarla, siento que me voy a enamorar jajaja:( # AguilaFusionLimon",,,# AguilaFusionLimon,1.17E+18,https://twitter.com/Paca__Gartee/status/1170930874264760320
sernabe,9/9/19 00:10,0,0,Aun no llega la que me gane @ CervezaAguila # AguilaFusionLimon,,@ CervezaAguila,# AguilaFusionLimon,1.17E+18,https://twitter.com/sernabe/status/1170927417243910144
Cristhi94720065,9/9/19 00:07,4,46,# AguilaFusionLimon nunca la.probe nunca me llego la botella que me gane,,,# AguilaFusionLimon,1.17E+18,https://twitter.com/Cristhi94720065/status/1170926753629560832
mikecstasy,9/9/19 00:07,0,2,Luego de probar la cerveza aguila fusion limon mis conclusiones son: -no entiendo como hay gente que dice que todas las cervezas saben igual. No. NoOoo. -no vuelvo a botar la plata comprando esa monda,,,,1.17E+18,https://twitter.com/mikecstasy/status/1170926564395143168
ValentinaHuilaR,9/9/19 00:03,0,5,"# AguilaFusionLimon por creaciones como estas yo no dejo la cerveza, NI LOCA",,,# AguilaFusionLimon,1.17E+18,https://twitter.com/ValentinaHuilaR/status/1170925724875800582
Girl_interrumpe,8/9/19 21:43,0,1,La aguila convencional me parece horrible pero la nueva de fusion limon esta severa.,,,,1.17E+18,https://twitter.com/Girl_interrumpe/status/1170890342142500864
CervezaAguila,8/9/19 20:50,0,1,"Viejo Tato, vamos a llegar a todos lo rincones del pais a mediados e septiembre, !ve convocando el combo pa' disfrutar el nuevo sabor de # AguilaFusionLimon!",,,# AguilaFusionLimon,1.17E+18,https://twitter.com/CervezaAguila/status/1170877135038418944
CervezaAguila,8/9/19 20:47,0,0,"Luisa, ?vamos por una # AguilaFusionLimon?, no olvides que aparecemos en todas la ciudades a mediados de septiembre.",,,# AguilaFusionLimon,1.17E+18,https://twitter.com/CervezaAguila/status/1170876359964549120
AnguieVelandia,8/9/19 20:30,0,0,Tu tan Club de Trigo y yo tan Aguila fusion limon. pic.twitter.com/hC62T5ECgm,,,,1.17E+18,https://twitter.com/AnguieVelandia/status/1170872178310549504
CervezaAguila,8/9/19 16:54,0,0,"!Claro que si, Maria! En unos dias encontraras nuestra # AguilaFusionLimon hasta en la tienda de la esquina, asi que bien pendiente del lanzamiento oficial. ! # Vivela!",,,# AguilaFusionLimon # Vivela,1.17E+18,https://twitter.com/CervezaAguila/status/1170817726102888448
Eojedaq,8/9/19 15:46,0,1,La aguila fusion limon SABE A AGUAAAAAAA....,,,,1.17E+18,https://twitter.com/Eojedaq/status/1170800593482465286
paula_amc,8/9/19 15:24,0,3,Confirmo que no me gusto la nueva Aguila Fusion Limon,,,,1.17E+18,https://twitter.com/paula_amc/status/1170794997597257730
vanemantilla21,8/9/19 13:44,0,0,Y ahora la nueva aguila fusion limon el ASCO https://twitter.com/carolayurueta/status/1170545055918153728 ...,,,,1.17E+18,https://twitter.com/vanemantilla21/status/1170769978590543872
CervezaAguila,8/9/19 11:49,0,1,"Yise, quiza un poquito mas fria para que puedas disfrutar mejor de nuestra # AguilaFusionLimon. ?No crees?",,,# AguilaFusionLimon,1.17E+18,https://twitter.com/CervezaAguila/status/1170740982050119681
nicolairojas8,8/9/19 11:15,0,4,"Esa Aguila fusion a limon es una mierda, cosa mal hecha; definitivamente no te cambio @ CervezaPoker",,@ CervezaPoker,,1.17E+18,https://twitter.com/nicolairojas8/status/1170732419332354049
16mafe01,8/9/19 10:19,0,16,"Sorry pero la aguila fusion limon es bien jopo, no se dejen enganar",,,,1.17E+18,https://twitter.com/16mafe01/status/1170718340211531778
MarieClaireSan,8/9/19 08:17,0,0,Updated: Aun no me llega mi # AguilaFusionLimon pero los lindos de @ CervezaAguila han sido atentos conmigo y me han dicho que pronto me llegara,,@ CervezaAguila,# AguilaFusionLimon,1.17E+18,https://twitter.com/MarieClaireSan/status/1170687690964119552
CervezaAguila,8/9/19 06:51,0,0,"!Nada de eso Dani!, tu # AguilaFusionLimon esta a punto de llegar, !pendiente!",,,# AguilaFusionLimon,1.17E+18,https://twitter.com/CervezaAguila/status/1170665978029645825
revistapym,7/9/19 23:00,0,0,Aguila Fusion Limon es la mas reciente apuesta de Cerveza Aguila para 2019. Se trata de una variedad que incluye un toque de limon y sera producida en la Cerveceria de Barranquilla. Mas informacion en https://bit.ly/30fGSCg,,,,1.17E+18,https://twitter.com/revistapym/status/1170547340165472258
KatherinArzuza,7/9/19 22:23,0,0,Invite a mi papa a tomarnos las nuevas aguila fusion limon que buen parche,,,,1.17E+18,https://twitter.com/KatherinArzuza/status/1170538153545011200
CervezaAguila,7/9/19 21:04,0,0,?Que tal te parecio la nueva # AguilaFusionLimon viejo Freddy?,,,# AguilaFusionLimon,1.17E+18,https://twitter.com/CervezaAguila/status/1170518154293981185
maria_acosta7,7/9/19 20:16,0,0,@ CervezaAguila aun podemos probar # AguilaFusionLimon ??? Nos morimos por tenerla en casa # AguilaFusionLimon # AguilaFusionLimon,,@ CervezaAguila,# AguilaFusionLimon # AguilaFusionLimon # AguilaFusionLimon,1.17E+18,https://twitter.com/maria_acosta7/status/1170506249412198401
CervezaAguila,7/9/19 19:53,0,0,"?Que mejor regalo que disfrutar entre todos una buena # AguilaFusionLimon? Es una abre bocas pa' que cuando salga a la venta, esten ahi atentos.",,,# AguilaFusionLimon,1.17E+18,https://twitter.com/CervezaAguila/status/1170500261351165953
Mariahpaularg,7/9/19 19:52,0,0,Creo que soy de las pocas que no le gusto la aguila fusion limon,,,,1.17E+18,https://twitter.com/Mariahpaularg/status/1170500178064769025
labodeguitamb,7/9/19 19:36,1,1,Es sabado y ellas lo saben # AguilaFusionLimon # Valledupar # SaludMiLlave # Beer # Friends # Colombia Ya la probaste? en La Bodeguita https://www.instagram.com/p/B2IV1t4FbZT/?igshid=sabf8to03f2b ...,,,# AguilaFusionLimon # Valledupar # SaludMiLlave # Beer # Friends # Colombia,1.17E+18,https://twitter.com/labodeguitamb/status/1170496053784797185
CervezaAguila,7/9/19 18:17,2,7,"!Asi es que es, viejo Rafa! Cuentanos que tanto te gusto nuestra # AguilaFusionLimon.",,,# AguilaFusionLimon,1.17E+18,https://twitter.com/CervezaAguila/status/1170476175178833920
Gmstiven,7/9/19 18:08,0,0,@ CervezaAguila me siento estafado sin mi Aguila fusion limon!,,@ CervezaAguila,,1.17E+18,https://twitter.com/Gmstiven/status/1170473977174773760
FelipeSanch,7/9/19 17:49,0,1,"Bueno, reportense para probar esa aguila fusion limon",,,,1.17E+18,https://twitter.com/FelipeSanch/status/1170469270276452353
CervezaAguila,7/9/19 17:33,0,0,!Siempre a tu lado; nunca te fallamos! Recuerda dejar tu # AguilaFusionLimon un buen rato en el refri pa' que recupere energia y la tomes como es.,,,# AguilaFusionLimon,1.17E+18,https://twitter.com/CervezaAguila/status/1170465146411638784
paulagarcia98,7/9/19 17:20,0,0,En otras noticias esa cerveza de Fusion Limon de Aguila sabe a pura Aguila Light con un lejanisimooooo sabor a limon,,,,1.17E+18,https://twitter.com/paulagarcia98/status/1170461888154673152
CervezaAguila,7/9/19 17:11,0,0,"Nunca, mi hermano. A mediados de mes encontraras nuestra # AguilaFusionLimon disponible en cada rincon del pais. ?Ya sabes con quien la vas a probar?",,,# AguilaFusionLimon,1.17E+18,https://twitter.com/CervezaAguila/status/1170459693174710273
CervezaAguila,7/9/19 17:07,0,1,"Brother, ?no participaste en ninguno de los concursos que hicimos como previa al lanzamiento de nuestra # AguilaFusionLimon?",,,# AguilaFusionLimon,1.17E+18,https://twitter.com/CervezaAguila/status/1170458548976922624
CervezaAguila,7/9/19 16:56,0,0,"Steph, a mediados de septiembre podras encontrar en la tienda del veci nuestra # AguilaFusionLimon.",,,# AguilaFusionLimon,1.17E+18,https://twitter.com/CervezaAguila/status/1170455897560244230
KatherineR___,7/9/19 16:53,0,11,Pues esa aguila fusion limon no es que sea la gran cosa.,,,,1.17E+18,https://twitter.com/KatherineR___/status/1170455052840030209
CervezaAguila,7/9/19 16:30,0,0,"Viejo Edu, !nos encanta leerte, dejanos saber como te parecio # AguilaFusionLimon.",,,# AguilaFusionLimon,1.17E+18,https://twitter.com/CervezaAguila/status/1170449247600336896
CervezaAguila,7/9/19 16:26,0,0,"Por que me late que aun no has probado la nueva # AguilaFusionLimon con el combo, mi Cami.",,,# AguilaFusionLimon,1.17E+18,https://twitter.com/CervezaAguila/status/1170448273192210433
CervezaAguila,7/9/19 16:26,0,0,"Viejo Pipe, !pendiente de nuestras redes! vamos por esa botella de # AguilaFusionLimon",,,# AguilaFusionLimon,1.17E+18,https://twitter.com/CervezaAguila/status/1170448193416499207
CervezaAguila,7/9/19 16:24,0,1,"!Buena vaina, mi hermanazo! Cuentanos que tal te parecio nuestra # AguilaFusionLimon.",,,# AguilaFusionLimon,1.17E+18,https://twitter.com/CervezaAguila/status/1170447671674527744
CervezaAguila,7/9/19 16:21,0,0,"Dani, Buenisimo que estes conectada con nuestra actividad, !vamos por esa botella!, pendiente de nuestras redes, ya se siente el sabor de AguilaFusionLimon.",,,,1.17E+18,https://twitter.com/CervezaAguila/status/1170446960916160514
CervezaAguila,7/9/19 16:16,0,0,"Estamos muy pendiente de ti, !falta poco para que la tengas en tus manos, vamos por esa # AguilaFusionLimon!",,,# AguilaFusionLimon,1.17E+18,https://twitter.com/CervezaAguila/status/1170445693703663617
CervezaAguila,7/9/19 16:11,0,1,"Mi bro, ya se siente el sabor # AguilaFusionLimon, !pendiente!, aun continuamos distribuyendo botellas.",,,# AguilaFusionLimon,1.17E+18,https://twitter.com/CervezaAguila/status/1170444517692051456
CervezaAguila,7/9/19 15:38,0,0,"Es cuestion de dias pa' que encuentres nuestra # AguilaFusionLimon en cada rincon del pais, viejo Andres. !Pendiente a nuestras redes sociales y el lanzamiento oficial!",,,# AguilaFusionLimon,1.17E+18,https://twitter.com/CervezaAguila/status/1170436319748771845
CervezaAguila,7/9/19 15:32,1,16,"Si no la recibe, dale cabida a la # AguilaFusionLimon en tu corazon ya que ella no lo merece.",,,# AguilaFusionLimon,1.17E+18,https://twitter.com/CervezaAguila/status/1170434730690564096
CervezaAguila,7/9/19 15:21,0,0,"Cuentanos que fue lo que mas te gusto de nuestra # AguilaFusionLimon, viejo @ Cristian_ArizaM.",,@ Cristian_ArizaM,# AguilaFusionLimon,1.17E+18,https://twitter.com/CervezaAguila/status/1170431825203867649
camilandreapp,7/9/19 15:11,1,9,Cuanto les estaria pagando cerveza aguila a los influencers por decir q la aguila fusion limon es rica,,,,1.17E+18,https://twitter.com/camilandreapp/status/1170429425369980928
CervezaAguila,7/9/19 15:10,0,0,? @ Williamalbertoq que tal te parecio nuestra # AguilaFusionLimon?,,@ Williamalbertoq,# AguilaFusionLimon,1.17E+18,https://twitter.com/CervezaAguila/status/1170429170708623360
CervezaAguila,7/9/19 15:05,0,0,"!Con gusto, @ Asandrade_! ?Cuentanos que tal te parecio nuestra # AguilaFusionLimon?",,@ Asandrade_,# AguilaFusionLimon,1.17E+18,https://twitter.com/CervezaAguila/status/1170427890539933702
Yugxn_09,7/9/19 15:03,0,8,"El Aguila Fusion limon representa todo lo que no quiero tomar nunca, qued decepcionada",,,,1.17E+18,https://twitter.com/Yugxn_09/status/1170427365660549120
CervezaAguila,7/9/19 15:01,0,0,"Oye @ MEJC95, ?que tal te parecio nuestra # AguilaFusionLimon?",,@ MEJC95,# AguilaFusionLimon,1.17E+18,https://twitter.com/CervezaAguila/status/1170426963787505669
carlosgarc93,7/9/19 14:47,0,0,Ad portas de probar la Aguila fusion limon.,,,,1.17E+18,https://twitter.com/carlosgarc93/status/1170423438588227584
LuchoElNinja,7/9/19 14:40,0,1,La aguila fusion limon sabe a MIERDA!!!!!,,,,1.17E+18,https://twitter.com/LuchoElNinja/status/1170421523640913923
mcamilaestrada_,7/9/19 14:21,0,1,?Alguien sabe donde puedo conseguir Cerveza Aguila fusion limon en Buga?,,,,1.17E+18,https://twitter.com/mcamilaestrada_/status/1170416934401314816
IsaHorta,7/9/19 14:02,0,1,Me parece que se aguila fusion limon es de las cervezas que mandan para el bano,,,,1.17E+18,https://twitter.com/IsaHorta/status/1170412041955434496
CervezaAguila,7/9/19 13:40,0,0,"!Bro, fresco que tu # AguilaFusionLimon va en camino!",,,# AguilaFusionLimon,1.17E+18,https://twitter.com/CervezaAguila/status/1170406605898338305
CervezaAguila,7/9/19 13:33,0,1,"Lau, pronto estara # AguilaFusionLimon en tu tienda mas cercana. !Vas a quedar sin aliento cuando pruebes nuestra fusion!",,,# AguilaFusionLimon,1.17E+18,https://twitter.com/CervezaAguila/status/1170404844471017472
CervezaAguila,7/9/19 13:32,0,1,"Lau, sabemos que estas muy ansiosa por probar nuestra # AguilaFusionLimon, pero no te pongas a inventar que nuestra fusion esta pa' no dejar ni una gota en la botella.",,,# AguilaFusionLimon,1.17E+18,https://twitter.com/CervezaAguila/status/1170404414743621632
CervezaAguila,7/9/19 13:00,0,1,"Yise, eres nuestra chica # AguilafusionLimon. Cuentanos, ?como estuvo esta espectacular fusion?",,,# AguilafusionLimon,1.17E+18,https://twitter.com/CervezaAguila/status/1170396346274238465
Nicolleum_,7/9/19 12:51,1,1,"Aguila se fajo con esa Aguila fusion limon, cosita tan rica",,,,1.17E+18,https://twitter.com/Nicolleum_/status/1170394149872386048
sebassilvera19,7/9/19 11:39,0,0,Esa aguila ligth fusion limon es cule vaina normal,,,,1.17E+18,https://twitter.com/sebassilvera19/status/1170376000179507203
lfernandacant,7/9/19 11:07,0,0,Esa cerveza Aguila fusion limon provoca escuchar el dulce sonido del liquido bajando por una alcantarilla.,,,,1.17E+18,https://twitter.com/lfernandacant/status/1170367908586950657
GMDLHM,7/9/19 10:49,0,0,Aguila fusion limon: 4/10,,,,1.17E+18,https://twitter.com/GMDLHM/status/1170363438520000512
CervezaAguila,7/9/19 09:57,0,0,?Y que tal la fusion tan bacana de # AguilaFusionLimon viejo Duber?,,,# AguilaFusionLimon,1.17E+18,https://twitter.com/CervezaAguila/status/1170350445774233601
hpimienta95,7/9/19 09:38,30,203,Tu novio. El que pide Aguila light fusion limon con servilleta.,,,,1.17E+18,https://twitter.com/hpimienta95/status/1170345593354510336
CervezaAguila,7/9/19 09:30,0,2,"Donnie, a ella le puedes llevar una # AguilaFusionLimon bien fria y seguro vas a conquistar ese corazon frio.",,,# AguilaFusionLimon,1.17E+18,https://twitter.com/CervezaAguila/status/1170343506403037189
CervezaAguila,7/9/19 09:24,0,0,"!Ricar, no digas eso!, el mensajero debe estar por llegar. Mas bien, cuando tengas en tu poder a nuestra # AguilaFusionLimon recuerda que debes tomarla muy fria.",,,# AguilaFusionLimon,1.17E+18,https://twitter.com/CervezaAguila/status/1170341982822109184
CervezaAguila,7/9/19 09:15,0,0,"!Viejo Migueeee!, ves que nuestra # AguilaFusionLimon llego. Solo era cuestion de paciencia. ?Que tal esta fusion de sabores?",,,# AguilaFusionLimon,1.17E+18,https://twitter.com/CervezaAguila/status/1170339911804882945
CervezaAguila,7/9/19 08:22,0,1,"Pa' el grado, pa' el cumpleanos y pa' el almuerzo, # AguilaFusionLimon, siempre queda bien.",,,# AguilaFusionLimon,1.17E+18,https://twitter.com/CervezaAguila/status/1170326412378673152
CervezaAguila,7/9/19 08:13,0,0,"Pero no hay afan viejo Lea, # AguilaFusionLimon ya va en camino y aparte es perfecta para disfrutarla a cualquier hora del dia.",,,# AguilaFusionLimon,1.17E+18,https://twitter.com/CervezaAguila/status/1170324318821277696
CervezaAguila,7/9/19 06:43,0,0,"!Esa es la actitud, Maria!, nuestra cerveza es perfecta para cualquier ocasion, y que mejor que para celebrar el amor y la amistad, una # AguilaFusionLimon.",,,# AguilaFusionLimon,1.17E+18,https://twitter.com/CervezaAguila/status/1170301667268415488
CervezaAguila,7/9/19 06:39,0,0,"!Bro, esa es la actitud!, yo vere cuando llegue nuestra # AguilaFusionLimon.",,,# AguilaFusionLimon,1.17E+18,https://twitter.com/CervezaAguila/status/1170300649491304449
CervezaAguila,7/9/19 06:22,0,1,"Luchito, ?que tal te parecio nuestra # AguilaFusionLimon?",,,# AguilaFusionLimon,1.17E+18,https://twitter.com/CervezaAguila/status/1170296219031212034
CervezaAguila,7/9/19 06:19,0,0,"!Tranqui, ?estas preparada para recibir tu # AguilaFusionLimon? ?Lista la fiesta?",,,# AguilaFusionLimon,1.17E+18,https://twitter.com/CervezaAguila/status/1170295630771736577
CervezaAguila,7/9/19 06:17,0,0,"Ricar, ?seguro ingresaste correctamente la direccion?, si es asi, pendiente del celu. !Tranqui!, que no te vas a quedar sin tu # AguilaFusionLimon.",,,# AguilaFusionLimon,1.17E+18,https://twitter.com/CervezaAguila/status/1170295133285302272
CervezaAguila,7/9/19 06:08,0,0,"Hola, nos alegra un monton que tu # AguilaFusionLimon ya este en tus manos. Recuerda que debes disfrutarla muy fria.",,,# AguilaFusionLimon,1.17E+18,https://twitter.com/CervezaAguila/status/1170292870462562304
suciavidaa,7/9/19 05:13,0,0,No se si es mas fea la cerveza aguila light o la fusion limon.,,,,1.17E+18,https://twitter.com/suciavidaa/status/1170278956634914816
_luchi25,7/9/19 00:37,0,3,Aguila fusion limon no es nada del otro mundo,,,,1.17E+18,https://twitter.com/_luchi25/status/1170209505956810752
AristiEdwin23,6/9/19 21:47,3,15,La verdad me esperaba mucho mas de la nueva # aguilafusionlimon,,,# aguilafusionlimon,1.17E+18,https://twitter.com/AristiEdwin23/status/1170166605738905601
winderbustos,6/9/19 21:17,0,0,@ CervezaAguila me gane una aguila fusion limon que llegaba el 2 de septiembre y no ha llegado,,@ CervezaAguila,,1.17E+18,https://twitter.com/winderbustos/status/1170159081245564929
MariaCg02,6/9/19 19:34,1,2,Con ganas de probar esa tal Aguila fusion limon,,,,1.17E+18,https://twitter.com/MariaCg02/status/1170133249898754048
valentinagutrz,6/9/19 19:17,0,2,Pa mi que el portero se tomo mi aguila fusion limon,,,,1.17E+18,https://twitter.com/valentinagutrz/status/1170128990251749377
CervezaAguila,6/9/19 17:10,0,0,?Y por que no mejor ganarse una Aguila Fusion Limon? Hoy a las 5 de la tarde estaremos regalando muchas cervezas. ?Te vas a quedar sin la tuya?,,,,1.17E+18,https://twitter.com/CervezaAguila/status/1170097009136680960
CervezaAguila,6/9/19 17:07,0,1,"Se llego el dia, hoy a las 5 de la tarde estaremos regalando pruebas de la nueva Aguila Fusion Limon en nuestra pagina. ?Te vas a quedar sin al tuya?",,,,1.17E+18,https://twitter.com/CervezaAguila/status/1170096151971926016
CervezaAguila,6/9/19 16:29,0,3,"!Buena vaina esa, Donnie! Cuentanos que tal te parecio nuestra # AguilaFusionLimon, que imaginamos la tomaste bien fria...",,,# AguilaFusionLimon,1.17E+18,https://twitter.com/CervezaAguila/status/1170086673264324608
Heyyoucr,6/9/19 15:53,0,1,"Ya sabes Lalu jajajaj, no te preocupes que pal grado te farreas tu # AguilaFusionLimon",,,# AguilaFusionLimon,1.17E+18,https://twitter.com/Heyyoucr/status/1170077601769172994
SandyAngel17,6/9/19 14:58,0,0,"Sip. y te la dejan en tu casita. pon en google aguila fusion limon y sigue los pasos del link que dice Celebremos con Cerveza Aguila""""",,,,1.17E+18,https://twitter.com/SandyAngel17/status/1170063720615239680
