username;date;0;00;text;geo;mentions;hashtags;id;permalink;sentimiento;rango
ejmh1984;2019-10-28 09:26;0;0;"Ayyy despeguela. Personas como.ud sobran. Deje que llegue nueva sangre. Ud no aporta nada..tibio";;;;"1188824276880764929";https://twitter.com/ejmh1984/status/1188824276880764929;Muy negativo;0.0645037759228937
__oecgfs;2019-10-28 09:26;0;0;"ENTONCES CLAUDIA LOPEZ SI GANO PQ NADIE ME DIJO ANOTHER A WIN FOR THE LESBIANS";;;;"1188824275840589824";https://twitter.com/__oecgfs/status/1188824275840589824;Muy positivo;0.8
alemar_dul;2019-10-28 09:26;2;4;"Aunque celebro que Uribe y su combo se han quemado hasta grado 3, sere incisiva en algo: Claudia Lopez ud misma labre su destino. Si se las embarra (haciendo el metro elevado o colocando a Sergio Fajardo o continuando con las ideas de Penalosa), hasta ahi llego Ud.";;;;"1188824259059159040";https://twitter.com/alemar_dul/status/1188824259059159040;Tendencia negativa;0.3534848330402013
DonCanas_;2019-10-28 09:26;0;1;"Mi familia extra uribista ya se van a vivir el sueno americano (Irse de ilegales a lavar banos) porque Claudia Lopez gano ayer y ya se montaron en la pelicula de la extrema izquierda.";;;;"1188824256479674369";https://twitter.com/DonCanas_/status/1188824256479674369;Muy negativo;0.01718842336181191
LeoBogotano;2019-10-28 09:25;0;0;"Maravillosa palabras de @ ClaudiaLopez al cierre de su discurso: "Bogota no va a cambiar porque hoy cambie la Alcaldia. Bogota va a cambiar de verdad si cada uno de nosotros, empezando por mi, decide ser un mejor ciudadano cada dia"";;@ ClaudiaLopez;;"1188824223164309504";https://twitter.com/LeoBogotano/status/1188824223164309504;Tendencia negativa;0.38939412708561844
gayfriendschat;2019-10-28 09:25;0;0;"Claudia Lopez: Bogota, # Colombia Elects Openly Gay Woman Mayor in Historic First :l ......";;;# Colombia;"1188824222451339264";https://twitter.com/gayfriendschat/status/1188824222451339264;Tendencia positiva;0.22222222222222224
freddymorris;2019-10-28 09:25;0;0;"Que se puede esperar de petro si no es mas que un revanchista politico y un egolatra";;;;"1188824218370224129";https://twitter.com/freddymorris/status/1188824218370224129;Muy negativo;0.0027717722052224385
KelRioss;2019-10-28 09:25;0;0;"En Manizales no estoy muy segura de la decision a la alcaldia, pero en Bogota, la rompieron con toda!! Me encanta!!! # alcaldiabogota # alcaldiamanizales # Manizales # Bogota # EleccionesColombia2019 # ClaudiaLopez # ClaudiaLopezAlcaldesa";;;# alcaldiabogota # alcaldiamanizales # Manizales # Bogota # EleccionesColombia2019 # ClaudiaLopez # ClaudiaLopezAlcaldesa;"1188824216063401986";https://twitter.com/KelRioss/status/1188824216063401986;Muy negativo;0.15115225181807254
John9418734461;2019-10-28 09:25;0;0;"Pues la verdad no se como fue su administracion Pero para que alla ganado el CD cuando Narino ya se esta sacando esa peste la deja entrar de nuevo Algo debio salir mal para que la gente volviera a la oscuridad";;;;"1188824203266576384";https://twitter.com/John9418734461/status/1188824203266576384;Muy negativo;0.07833208172311426
NathalyBarrera;2019-10-28 09:25;0;0;"Que rico despertar y ver que a los ignorantes les pica el cuerpo, y les va a picar por 4 anitos mas como minimo. Viven en el siglo de upa, a moverse con el mundo que este no para!";;;;"1188824198950592517";https://twitter.com/NathalyBarrera/status/1188824198950592517;Muy positivo;0.7139263057838392
FCadena_;2019-10-28 09:25;0;0;"@ ClaudiaLopez @ PartidoVerdeCoL Felicitaciones por este triunfo. Que sea el primer paso para darle a Colombia lo que merece. # SorpresasTeDaLaVida # BogotaDecidio # EleccionesColombia2019";;@ ClaudiaLopez @ PartidoVerdeCoL;# SorpresasTeDaLaVida # BogotaDecidio # EleccionesColombia2019;"1188824192659197955";https://twitter.com/FCadena_/status/1188824192659197955;Tendencia positiva;0.5252766897787104
wimo15;2019-10-28 09:25;0;0;"Por que no a denunciado la corrupcion del metrucho elevado que quieres hacer para perpetuar Transmilenio";;;;"1188824179870707712";https://twitter.com/wimo15/status/1188824179870707712;Muy negativo;0.010107102926145153
Alejo_Sol1120;2019-10-28 09:25;0;1;"Esta confundiendo sujetos en su tweet, por lo tanto argumentando muy mal.";;;;"1188824179400945674";https://twitter.com/Alejo_Sol1120/status/1188824179400945674;Muy negativo;0.0414288728440191
garcia_1688;2019-10-28 09:25;1;1;"Esta senora incluso el dia de su voto haciendo fraude y cometiendo delito electoral,vaya y eso hubiera sido los del CD el escandalo que hubieran echo.";;;;"1188824177349922816";https://twitter.com/garcia_1688/status/1188824177349922816;Muy negativo;0.02399860614776944
Davinchi__A;2019-10-28 09:25;0;0;"Y me encanto la victoria de @ ClaudiaLopez, porque aun despues de la hijueputada de @ petrogustavo y @ HOLLMANMORRIS logro convertirse en la primera alcaldesa de Bogota, y con tremenda votacion!";;@ ClaudiaLopez @ petrogustavo @ HOLLMANMORRIS;;"1188824169699516417";https://twitter.com/Davinchi__A/status/1188824169699516417;Tendencia negativa;0.46530332958645204
PublicaAdmon;2019-10-28 09:25;0;0;"Perfecto";;;;"1188824166054748167";https://twitter.com/PublicaAdmon/status/1188824166054748167;Muy positivo;0.883328612979356
waydim;2019-10-28 09:25;0;0;"No escuche nada sobre el Metro en el discurso de @ ClaudiaLopez Espero que esta vez pregunte a quienes viven en Bogota que opcion consideran mas conveniente para todos.";;@ ClaudiaLopez;;"1188824162665668608";https://twitter.com/waydim/status/1188824162665668608;Tendencia negativa;0.3429871659810893
JairoPachn1;2019-10-28 09:25;0;0;"Seguimiento hay que hacer ! No al transmilenio por la Av Boyaca! EL METRO ELEVADO VA A REVENTAR BOGOTA!";;;;"1188824156617531392";https://twitter.com/JairoPachn1/status/1188824156617531392;Tendencia negativa;0.46526614679783734
KlaoRpr;2019-10-28 09:25;0;0;"@ ClaudiaLopez  ...";;@ ClaudiaLopez;;"1188824150976143365";https://twitter.com/KlaoRpr/status/1188824150976143365;Neutral;0.0
adelavegavisval;2019-10-28 09:25;0;0;"Fue un ejemplo de candidato, GRANDE. Con respeto, con valores y conocimiento para el cargo de Alcalde. Asi es gano la democracia y desearle muchos exitos a la nueva alcaldesa para que haya continuidad en los proyectos por esta hermosa ciudad @ ClaudiaLopez";;@ ClaudiaLopez;;"1188824131778895872";https://twitter.com/adelavegavisval/status/1188824131778895872;Muy negativo;0.25352525850823693
sandrarod64;2019-10-28 09:25;0;0;"sabia usted que cualquier cosa mal liderada es danina, perdon es mi humilde opinion.";;;;"1188824125051228163";https://twitter.com/sandrarod64/status/1188824125051228163;Muy negativo;0.17701863963945255
Fercho88740396;2019-10-28 09:25;0;0;"Para que hagan mas roscones y mas arepaspic.twitter.com/AeQkcYGjCg";;;;"1188824124132679681";https://twitter.com/Fercho88740396/status/1188824124132679681;Muy negativo;0.2828680748973342
karl_r2_d2;2019-10-28 09:25;0;0;"Con el senor Claudio Torpez como alcalde se abre un portal donde entran los peores demonios del feminismo radical y lo peor de la correccion politica.";;;;"1188824123520233472";https://twitter.com/karl_r2_d2/status/1188824123520233472;Muy negativo;0.05430107191643848
Yourmung;2019-10-28 09:25;1;4;"Si, politiquero light con buena imagen. Pero si el "efecto teflon" de Uribe se le empieza a acabar, dudo que el de Fajardo dure mucho. De a pocos se le caera la fachada que le han armado.";;;;"1188824114657665024";https://twitter.com/Yourmung/status/1188824114657665024;Muy negativo;0.055209985079809384
CaritoG37408293;2019-10-28 09:25;0;0;"Dr Robledo el Petrismo demostro que su intencion era bajar a Claudia por no apoyar a su lider en las presidenciales de 2022, por eso creo que si va a juzgarlo porque no es lo que a el le conviene. Esa actitud es reprochable y no me parece que se deba pasar por alto";;;;"1188824110463365121";https://twitter.com/CaritoG37408293/status/1188824110463365121;Muy negativo;0.026259318712632967
oreana22;2019-10-28 09:25;0;0;"asi o mas comprometidos por @ Bogota !! Vamos @ ClaudiaLopez este es nuestro momento.";;@ Bogota @ ClaudiaLopez;;"1188824103400235009";https://twitter.com/oreana22/status/1188824103400235009;Neutral;0.0
jorgecuello9;2019-10-28 09:25;0;0;"Ud no es mujer es lesbiana";;;;"1188824092696350721";https://twitter.com/jorgecuello9/status/1188824092696350721;Muy negativo;0.12033975768236915
Cherry__bomb__;2019-10-28 09:25;0;1;"Si yo me gano una alcaldia tambien le meto el que culo de entrompe a mi marido, no le veo problema a la foto de @ ClaudiaLopez , al contrario, me encanta. Mujeres imparables demostrando su amor al mundo.";;@ ClaudiaLopez;;"1188824092562075648";https://twitter.com/Cherry__bomb__/status/1188824092562075648;Muy negativo;0.13238555254122064
CarlosEBlanco1;2019-10-28 09:25;0;0;"No se ponen de acuerdo.";;;;"1188824079517868032";https://twitter.com/CarlosEBlanco1/status/1188824079517868032;Muy negativo;0.14590018956462764
HenaoRamon;2019-10-28 09:25;0;0;"No pasa nada. Hay famosos, ricos, de sociedad , que fuman marihuana, aspiran coca. Todo a escondidas!!!";;;;"1188824069778673665";https://twitter.com/HenaoRamon/status/1188824069778673665;Muy negativo;0.06143854642981965
mayejaneth26;2019-10-28 09:25;0;0;"Los alternativos o progresistas o como quieran llamarse TIENEN que hacer la diferencia y gobernar por y para la gente.Hacer la diferencia. De eso depende la presidencia en 2022 y derrotar de una vez por todas el cancer del uribismo. No nos fallen! @ ClaudiaLopez @ QuinteroCalle";;@ ClaudiaLopez @ QuinteroCalle;;"1188824068205756421";https://twitter.com/mayejaneth26/status/1188824068205756421;Muy negativo;0.007747897127960988
alexbuchely;2019-10-28 09:25;0;0;"Estimado senador @ JERobledo ya quisiera decir que por poco gana Uribe en las presidenciales pero es una realidad gracias a la misma aptitud que asumio usted en esas elecciones";;@ JERobledo;;"1188824066800672768";https://twitter.com/alexbuchely/status/1188824066800672768;Muy negativo;0.12278336175328905
digoloquenoven;2019-10-28 09:25;0;0;"Por que no solo petro va a estar encima es el pueblo pendejo Entiende.";;;;"1188824066087632901";https://twitter.com/digoloquenoven/status/1188824066087632901;Muy negativo;0.01067079037489834
DanielaCelisR;2019-10-28 09:25;0;0;"Claudia Lopez habla sobre polemica por beso con Angelica Lozano :manifestacion:de:amor:es:falta:de:respeto:claudia:lopez:sobre:beso:con:lozano:231039:ie431 ...";;;;"1188824063478812678";https://twitter.com/DanielaCelisR/status/1188824063478812678;Tendencia negativa;0.35864407724195935
JoseHernandez_8;2019-10-28 09:25;0;1;"Como: @ soyconservador @ PartidoLiberal @ PartidoMIRA Esos perros, nosotros no, somos puro amor y arena.";;@ soyconservador @ PartidoLiberal @ PartidoMIRA;;"1188824054414872576";https://twitter.com/JoseHernandez_8/status/1188824054414872576;Tendencia positiva;0.5178282176447051
AndresLector;2019-10-28 09:25;0;0;"Lo que menos deberia importar, a la comunidad general, pero sobretodo a los medios es que @ ClaudiaLopez sea lesbiana, que se le reconozca por sus capacidades y talante para luchar por el cargo y ahora para ejercerlo. Felicitaciones alcaldesa.";;@ ClaudiaLopez;;"1188824050367451136";https://twitter.com/AndresLector/status/1188824050367451136;Muy negativo;0.10602998403742445
JeimmyCano;2019-10-28 09:25;0;0;"Farzando";;;;"1188824048651952129";https://twitter.com/JeimmyCano/status/1188824048651952129;Neutral;0.0
lucero5412;2019-10-28 09:25;0;0;"Gracias Doctor Miguel, usted sigue y seguira siendo lo mejor para Bogota. Lo acompanare siempre.";;;;"1188824047016173568";https://twitter.com/lucero5412/status/1188824047016173568;Muy negativo;0.25460050479049245
Miguelleon_xD;2019-10-28 09:25;0;0;"Sinceramente no creo que haya perdido ?sabe porque? Porque el ha incentivado un cambio, la Colombia humana a ganado en medellin, manizales entre otros lugares, espero que si esta condenado al fracaso caiga abrupta mente y si es corrupto mas aun y que llegue alguien aun mejor";;;;"1188824046554800128";https://twitter.com/Miguelleon_xD/status/1188824046554800128;Muy negativo;0.03437146269053977
JOHNCARELESRIVE;2019-10-28 09:25;0;0;"Ninguna manifestacion entre adultos no, pero como el ejemplo a nuestros ninos, si !! y asi sucesivamente, frescos que estamos empezando!!!pic.twitter.com/M6BssSBrDG";;;;"1188824031748907009";https://twitter.com/JOHNCARELESRIVE/status/1188824031748907009;Tendencia positiva;0.5133950047898355
yyrm04;2019-10-28 09:25;0;0;"Hola Ricardo, es la Dra Claudia Lopez, y lo mas triste es que me da la impresion de ser la Chavez version mujer. En fin ojala yo me equivoque";;;;"1188824031484633092";https://twitter.com/yyrm04/status/1188824031484633092;Muy negativo;0.0424325023231068
jguasaquillo;2019-10-28 09:25;0;0;"Que Dios las perdone";;;;"1188824029010059264";https://twitter.com/jguasaquillo/status/1188824029010059264;Muy negativo;0.13042282583864442
exoticopapagayo;2019-10-28 09:25;0;0;"Solo espero que @ ClaudiaLopez sea capas de retroceder el esperpento del metro que de manera arbitraria y amalanguada fue aprobado. Su plan de gobierno le da continuidad a buenos proyectos... la gente hablo y se canso de la polarizacion y la demagogia de Petro y Uribe.";;@ ClaudiaLopez;;"1188824025025384449";https://twitter.com/exoticopapagayo/status/1188824025025384449;Muy negativo;0.0028121122051500114
gavilan217;2019-10-28 09:25;0;1;"Esto me hace acordar de samuelito Moreno.";;;;"1188824024803139584";https://twitter.com/gavilan217/status/1188824024803139584;Muy negativo;0.05348146436686303
JOSEFERWOLF;2019-10-28 09:25;0;0;"Pero si no existe nadie mas sectario que ud.";;;;"1188824022487834624";https://twitter.com/JOSEFERWOLF/status/1188824022487834624;Muy negativo;0.07003480436890523
Andrescbr5;2019-10-28 09:25;0;0;"A @ ClaudiaLopez no tienen como atacarla por corrupta o ladrona, pero aun asi la atacan por sus asuntos personales, esos atacantes solo tienen popo en la cabeza.";;@ ClaudiaLopez;;"1188824019925176323";https://twitter.com/Andrescbr5/status/1188824019925176323;Muy negativo;0.006799568992442274
erneycandia67;2019-10-28 09:25;0;0;"Areperas mariconas";;;;"1188824016569749504";https://twitter.com/erneycandia67/status/1188824016569749504;Muy negativo;0.006463486879613384
ode_gloria;2019-10-28 09:24;0;0;"pic.twitter.com/3tBcfbDHEp";;;;"1188823981291376640";https://twitter.com/ode_gloria/status/1188823981291376640;Neutral;0.0
_m_a_l_t_e_s_;2019-10-28 09:24;0;0;"Una empresa sin metro";;;;"1188823977940213760";https://twitter.com/_m_a_l_t_e_s_/status/1188823977940213760;Neutral;0.0
GlaceCarrot;2019-10-28 09:24;0;0;"Son el cancer de Latinoamerica";;;;"1188823973016064000";https://twitter.com/GlaceCarrot/status/1188823973016064000;Tendencia negativa;0.41274556194663503
MelissaDelahoz;2019-10-28 09:24;0;0;"Si ahi estuve gran parte de la discordia.";;;;"1188823960202424320";https://twitter.com/MelissaDelahoz/status/1188823960202424320;Neutral;0.0
csvsantillan;2019-10-28 09:24;0;5;"No apoye a @ ClaudiaLopez por diferentes razones pero la defendere de los ataques puritanos de los que est siendo victima, el hecho que sea lesbiana no le resta entereza como ser humano ni como mujer, asi que cojan oficio y ejerzan como veedores de su gestion como alcaldesa.";;@ ClaudiaLopez;;"1188823959862677509";https://twitter.com/csvsantillan/status/1188823959862677509;Muy negativo;0.004066982265457028
ANNALVAREZG;2019-10-28 09:24;0;0;"Lo mejor es que ya no lo tendremos en el congreso !";;;;"1188823948332617731";https://twitter.com/ANNALVAREZG/status/1188823948332617731;Tendencia negativa;0.45195619001204357
gernar24;2019-10-28 09:24;0;0;"Comienza el principio del final de Claudia Lopez como politica, estare atento al momento, para hacer el respectivo RT.";;;;"1188823940346589184";https://twitter.com/gernar24/status/1188823940346589184;Tendencia positiva;0.536020728523962
olgalugomez;2019-10-28 09:24;0;0;"No veo bien la portada, la veo morbosa. La noticias es que @ ClaudiaLopez gano la Alcaldia de Bogota, su movimiento, sus propuestas, que es mujer... pero un beso con su pareja, no dice nada, en lo absoluto.";;@ ClaudiaLopez;;"1188823939407056902";https://twitter.com/olgalugomez/status/1188823939407056902;Tendencia positiva;0.5206180374596636
SantosTuto;2019-10-28 09:24;2;4;"Las dos Colombias: @ ClaudiaLopez : De clase media, estudio con esfuerzo, senadora con votos de opinion, alcaldesa, nadie le regalo nada. @ GabrielSantosCD: De clase alta, no termino la carrera de derecho, es congresista con los votos de Uribe y todo en la vida se lo han regalado.";;@ ClaudiaLopez @ GabrielSantosCD;;"1188823937867829248";https://twitter.com/SantosTuto/status/1188823937867829248;Muy negativo;0.017058188862996076
Sumerce;2019-10-28 09:24;0;0;"Interesante saber porque al final de la carrera electoral los medios decian, repetian que ganaba @ CarlosFGalan y @ ClaudiaLopez, si acaso, le aranaba el segundo lugar? A que juegan los medios replicando esas # encuestas Porque esa falta de seriedad en la investigacion?";;@ CarlosFGalan @ ClaudiaLopez;# encuestas;"1188823920771768320";https://twitter.com/Sumerce/status/1188823920771768320;Muy negativo;0.08631025486029081
DIEGO_RINCON_A;2019-10-28 09:24;0;0;"Vadgame Dios pic.twitter.com/vv2JMo8Gzx";;;;"1188823914492899329";https://twitter.com/DIEGO_RINCON_A/status/1188823914492899329;Neutral;0.0
diesuarezc;2019-10-28 09:24;0;0;"@ petrogustavo en lugar de montar una guerra por toda la ciudad, Al no poder hacer el metro subterraneo en su primera linea, Luche por que las que propone @ ClaudiaLopez se hagan subterraneas y se ejecuten, Sean con usted o con cualquier gobernante, Demuestre amor por @ Bogota .";;@ petrogustavo @ ClaudiaLopez @ Bogota;;"1188823913758953472";https://twitter.com/diesuarezc/status/1188823913758953472;Muy positivo;0.9529596813921548
chepejoker;2019-10-28 09:24;0;0;"Jaajajja, ella es arcoiris. Relax.";;;;"1188823912949469187";https://twitter.com/chepejoker/status/1188823912949469187;Neutral;0.0
cielikolindo;2019-10-28 09:24;2;9;"Grandes noticias para mi amada Colombia: Claudia Lopez ha sido elegida alcaldesa de Bogota, y el partido feminista # EstamosListas ha conseguido una concejala en Medellin. Felicidades, companeras colombianas! # FeminsmoParaVivirEnPaz";;;# EstamosListas # FeminsmoParaVivirEnPaz;"1188823901050232833";https://twitter.com/cielikolindo/status/1188823901050232833;Muy negativo;0.27857280377195925
pelaez40;2019-10-28 09:24;0;0;"Aplaudo el hecho de que una hija de maestra sea la nueva alcaldesa de Bogota. Hay muchas esperanzas puestas ahi.";;;;"1188823900764987393";https://twitter.com/pelaez40/status/1188823900764987393;Tendencia positiva;0.5482423411939804
roberthescobar;2019-10-28 09:24;0;0;"Esa es Claudia la ganadora de las elecciones a la alcaldia de Bogota, la que esta debajo de tus axilas, que fotaza";;;;"1188823896209940481";https://twitter.com/roberthescobar/status/1188823896209940481;Muy negativo;0.2961654606587258
dalheEzequiel;2019-10-28 09:24;0;0;"No ultimo domingo, dia 27 de outubro de 2019, a centro:esquerda assumidamente lesbica, Claudia Lopez, foi eleita a nova prefeita da cidade de Bogota, na Colombia. Foram 35,24% dos votos validos... :elege:primeira:prefeita:lesbica:da:historia/ ...";;;;"1188823896172236802";https://twitter.com/dalheEzequiel/status/1188823896172236802;Neutral;0.0
Marce00827927;2019-10-28 09:24;0;0;"Gano el que dijo Mockus";;;;"1188823894892994560";https://twitter.com/Marce00827927/status/1188823894892994560;Muy negativo;0.06635242720504876
Sergioandi13;2019-10-28 09:24;0;0;"Viejo caremica me bloqueo. pic.twitter.com/82D34SHnHK";;;;"1188823894037352448";https://twitter.com/Sergioandi13/status/1188823894037352448;Neutral;0.0
OscarCa52281456;2019-10-28 09:24;0;0;"Son tan homofobicos y se rasgan las vestiduras de una alcaldeza lesbiana @ ClaudiaLopez pero les encanta que @ AlvaroUribeVel les vivadando por el culo...Saludos a los cristianos que le vendieron el alma a el diablo";;@ ClaudiaLopez @ AlvaroUribeVel;;"1188823883660566533";https://twitter.com/OscarCa52281456/status/1188823883660566533;Muy negativo;0.010983982700906272
bogotaoso;2019-10-28 09:24;0;0;"Bendita sea Sodoma mas cerca de las estrellas.";;;;"1188823871350345729";https://twitter.com/bogotaoso/status/1188823871350345729;Tendencia positiva;0.659664783654582
jerodriguez28;2019-10-28 09:24;1;0;"Pesimo servicio de @ TransMilenio y los empleados enfermos, hay trabajo @ ClaudiaLopez  ...";;@ TransMilenio @ ClaudiaLopez;;"1188823867697045505";https://twitter.com/jerodriguez28/status/1188823867697045505;Muy negativo;0.025747893328803534
joseryeth;2019-10-28 09:24;0;0;"Solo veo y sigo las cosas como deberian ser y como la naturaleza las hace tal vez para su existencia, comprendo los q hallan nacido en cuerpo ajeno. Que hagan lo q quieran en privado es cuestion de cada quien, critico la exhibicion, espectaculo a proposito como los del C.C Andino";;;;"1188823866195529728";https://twitter.com/joseryeth/status/1188823866195529728;Tendencia negativa;0.41456200305660346
JeimmyCano;2019-10-28 09:24;0;0;"Ese sr ya se siente presidente con los votos de Nayibe";;;;"1188823861049069568";https://twitter.com/JeimmyCano/status/1188823861049069568;Muy negativo;0.20918169718844914
chatarrafina;2019-10-28 09:24;0;0;"Antanas es el gran elector de Bogota gracias al pueblo de la Colombia Humana que Petro manda estrategicamente a todos los movimientos para hacerlos ganar y asi poder decir que el nunca perdio. # Sarcasm";;;# Sarcasm;"1188823855642619904";https://twitter.com/chatarrafina/status/1188823855642619904;Muy negativo;0.011395445754984874
DavidDiazMZ;2019-10-28 09:24;0;1;"?Ya @ ClaudiaLopez nombro la comision investigativa del metro elevado que dijo madrugar a nombrar hoy? # ClaudiaAlcaldesa";;@ ClaudiaLopez;# ClaudiaAlcaldesa;"1188823852308226052";https://twitter.com/DavidDiazMZ/status/1188823852308226052;Tendencia negativa;0.478787198469177
jiatoga;2019-10-28 09:24;0;0;"Jajajajaja ardidopic.twitter.com/k4HK30b3FB";;;;"1188823848592068610";https://twitter.com/jiatoga/status/1188823848592068610;Neutral;0.0
neoflash5;2019-10-28 09:24;0;0;"para el 22 esta foto veremos que peso tienepic.twitter.com/pYRGx3NaVz";;;;"1188823848331939841";https://twitter.com/neoflash5/status/1188823848331939841;Tendencia negativa;0.3198090957070616
Marce00827927;2019-10-28 09:24;0;0;"Claro, es un caudillo";;;;"1188823846473945088";https://twitter.com/Marce00827927/status/1188823846473945088;Tendencia negativa;0.3671295341875606
julyortega78;2019-10-28 09:24;0;0;"Por lo menos @ ClaudiaLopez tiene la capacidad de amar y demostrarlo dejemos la doble moral , soy hetero ,casada, catolica y con hijos y lo que mas anhelo es que ellos amen, toleren y respeten finalmente eso es lo que hace un mundo mejor he dicho ! pic.twitter.com/HNxhOdfj6b";;@ ClaudiaLopez;;"1188823839838482432";https://twitter.com/julyortega78/status/1188823839838482432;Tendencia negativa;0.34893139758586716
riskmaco;2019-10-28 09:24;0;0;"A @ petrogustavo lo dejan que actue como la liebre que tarde que temprano caera. La IZQUIERDA quiere hacernos dirigir la mirada a este ser, pero si nos descuidamos como en estas elecciones regionales habra presidente y mayorias en el Congreso zurdas.";;@ petrogustavo;;"1188823839314251777";https://twitter.com/riskmaco/status/1188823839314251777;Tendencia positiva;0.5138553350329641
stephanygutca;2019-10-28 09:24;0;0;"Yo de verdad creo que esto es un sueno, no puedo creer que Orlando Benitez haya ganado en Cordoba y que Vicentico Blel haya ganado en Bolivar, ni hablar de Claudia Lopez en Bogota... estoy en shock!";;;;"1188823835681972224";https://twitter.com/stephanygutca/status/1188823835681972224;Tendencia negativa;0.3958932309476235
maxmaye15354547;2019-10-28 09:24;2;5;"Se juzgara por sus obras, si hiciera las cosas mal sin duda nos opondremos ...";;;;"1188823828459327488";https://twitter.com/maxmaye15354547/status/1188823828459327488;Muy positivo;0.8850411457988447
digoloquenoven;2019-10-28 09:24;0;0;"Y esperamos que no se te olvide que eres de independiente ok";;;;"1188823827805016064";https://twitter.com/digoloquenoven/status/1188823827805016064;Tendencia positiva;0.5694434313850871
tapapagu80;2019-10-28 09:24;0;0;"La verdad si los bogotanos la eligieron es por algo, es una persona inteligente, muy preparada y que ha salido adelante por si misma, asi que dejen de mirar Tanto su condicion sexual, ante todo somos seres humanos y merecemos respeto.";;;;"1188823825502355457";https://twitter.com/tapapagu80/status/1188823825502355457;Muy negativo;0.05509593689876943
06Savada;2019-10-28 09:24;0;0;"Si ella "gobierna bien" ninguna "mirada sectaria" le quita sus meritos.Usted aproveche su respaldo hacia ella,para conseguir lo mejor para Bogota.";;;;"1188823819236118528";https://twitter.com/06Savada/status/1188823819236118528;Muy negativo;0.1012070648868669
ElChanguas_;2019-10-28 09:24;0;0;"Hola Jennifer, mal ahi, nos tocaria tenerle asco a todos los pecadores, entre ellos nosotros, porque recuerda que justo no hay ni aun uno y que el pecado es pecado en todas sus formas, nos llamaron a ser luz, no a juzgar y a insultar, un abrazo y bendiciones.";;;;"1188823807622074368";https://twitter.com/ElChanguas_/status/1188823807622074368;Muy negativo;0.03868631256149513
feliperspicuo;2019-10-28 09:24;0;1;"Hermosas y muy inspiradoras";;;;"1188823787791441921";https://twitter.com/feliperspicuo/status/1188823787791441921;Muy positivo;0.9834920857108614
jorbaes;2019-10-28 09:24;1;1;"Eso se lo dijo @ HOLLMANMORRIS en mas de un debate, no se senador en que pais vive. El mandato de cualquier gobernante se debe mirar con justicia, ustedes no le estan parando bolas al minimetro elevado corrupto de Bogota y venden la idea de ser un partido impoluto.";;@ HOLLMANMORRIS;;"1188823782640771072";https://twitter.com/jorbaes/status/1188823782640771072;Muy negativo;0.09765057609228757
miguelaneodmar;2019-10-28 09:24;0;0;"Y donde esta la educacion distrital que recibio x alli no dice nada el externado no tiene nada de humilde !";;;;"1188823778962366465";https://twitter.com/miguelaneodmar/status/1188823778962366465;Muy negativo;0.006981499425971644
