username;date;0;00;text;geo;mentions;hashtags;id;permalink;sentimiento;rango
noesfaciil;2019-10-28 05:18;0;0;"Medellin, la cuna de Alvaro Uribe Velez, o por lo menos una parte, se canso de los candidatos de su partido que siempre prometen y prometen cosas, pero al final no son mas que frases de cajon pegadas con babas.";;;;"1188761954195857408";https://twitter.com/noesfaciil/status/1188761954195857408;Muy negativo;0.08830765937283844
RMadrinanV;2019-10-28 05:05;0;0;"Que no aprendieron la leccion. Hace 4 anos ya el uribismo habia perdido la alcaldia de Medellin con Juan Carlos Velez. Una vez mas fueron soberbios y pusieron un mal candidato a sostener el aviso de ser el que dijo Uribe. Eso despues del fiasco de Duque no basta.";;;;"1188758748946415616";https://twitter.com/RMadrinanV/status/1188758748946415616;Muy negativo;0.0039404072895005615
WRadioColombia;2019-10-28 05:00;0;4;"El senador Alvaro Uribe Velez habla sobre investigacion en su contra en Manizales >>https";;;;"1188757299784863744";https://twitter.com/WRadioColombia/status/1188757299784863744;Muy negativo;0.05907206233842593
placido305;2019-10-28 04:55;0;0;"El Uribismo perdio en: Bucaramanga Bogota Cali Medellin Santa Marta Cucuta Manizales Monteria Boyaca Cesar Cordoba Caqueta Esto me devuelve la esperanza en Colombia, hoy es el comienzo del fin de Alvaro Uribe Velez.";;;;"1188756236671557634";https://twitter.com/placido305/status/1188756236671557634;Muy negativo;0.07394127041115019
Don_lovoe;2019-10-28 04:53;0;1;"Jijij me hizo reir . Feliz dia bendiciones y un abrazo";;;;"1188755663213727744";https://twitter.com/Don_lovoe/status/1188755663213727744;Muy positivo;0.7775199309704849
Don_lovoe;2019-10-28 04:52;0;1;"Ok. Cuidate mucho Dios te bendiga Hoy y siempre pic.twitter.com/8wH5CRPXpx";;;;"1188755441544773634";https://twitter.com/Don_lovoe/status/1188755441544773634;Neutral;0.0
Don_lovoe;2019-10-28 04:51;0;0;"PA LANTE QUE ES PA YA FUERZA URIBISTA";;;;"1188755125659230208";https://twitter.com/Don_lovoe/status/1188755125659230208;Neutral;0.0
Don_lovoe;2019-10-28 04:49;1;1;"Muy buenos dias mi amiga Nella. Bendiciones y un abrazo . Yo desperte tranquilo pero triste . Gracias por tu saludo pic.twitter.com/eSezuHUOUE";;;;"1188754597835358208";https://twitter.com/Don_lovoe/status/1188754597835358208;Tendencia negativa;0.4599684890836192
Don_lovoe;2019-10-28 04:47;0;4;"Asi es mi amiga. Dia amargo para Colombia.pic.twitter.com/5Iq9wTAAZp";;;;"1188754133035225089";https://twitter.com/Don_lovoe/status/1188754133035225089;Neutral;0.0
Don_lovoe;2019-10-28 04:42;2;3;"LOS COLOMBIANOS SON CIEGOS, SORDOS Y MUDOS. QUIEREN UNA TAJADA DE PASTEL DE MIERDA VOTEN POR LA IZQUIERDA.";;;;"1188753003643375617";https://twitter.com/Don_lovoe/status/1188753003643375617;Neutral;0.0
MariaPe29783452;2019-10-28 04:42;0;0;"Jajajajaja jajajajaja que viva el mejor presidente de Colombia a traves de la historia el respetable y honorable doctor Alvaro Uribe Velez";;;;"1188752960463015936";https://twitter.com/MariaPe29783452/status/1188752960463015936;Muy negativo;0.18235431327381252
Don_lovoe;2019-10-28 04:40;0;1;"Amen";;;;"1188752299679727618";https://twitter.com/Don_lovoe/status/1188752299679727618;Neutral;0.0
Don_lovoe;2019-10-28 04:39;0;0;"LA MANO DE SANTOS ESTUVO PRESENTE.";;;;"1188752232717701120";https://twitter.com/Don_lovoe/status/1188752232717701120;Neutral;0.0
MariaPe29783452;2019-10-28 04:36;0;0;"Doctor Alvaro Uribe Velez usted es un gran hombre el mejor presidente de este pais a traves de la historia de Colombia";;;;"1188751279062945792";https://twitter.com/MariaPe29783452/status/1188751279062945792;Tendencia negativa;0.3843149085406037
Don_lovoe;2019-10-28 04:35;1;4;"ASCO. VERGUENZA. BOGOTA ELIGIO QUE SE AGUANTEN.";;;;"1188751226466422784";https://twitter.com/Don_lovoe/status/1188751226466422784;Neutral;0.0
Don_lovoe;2019-10-28 04:34;0;2;"NO SABEMOS. SON TAN DE BUENAS QUE CLAUDIA TENGA SU GUARDADO.";;;;"1188750999856529408";https://twitter.com/Don_lovoe/status/1188750999856529408;Neutral;0.0
JSebastianNF;2019-10-28 04:30;0;0;"Ese fue Alvaro Uribe Velez y fue en Medellin y fue destituido por nexos con el Cartel de Medellin. Pildora para la memoria.";;;;"1188749844363599872";https://twitter.com/JSebastianNF/status/1188749844363599872;Muy negativo;0.05107586401478471
Don_lovoe;2019-10-28 04:26;3;12;"Ahi le dejo un mural para que recuerden. Dios nos regala un nuevo dia gracias SENOR. Feliz lunes y feliz inicio de semana. Los quiero de y de gratis Dios es Amor . Feliz lunes. pic.twitter.com/PPd2ao4M7o";;;;"1188748847763378177";https://twitter.com/Don_lovoe/status/1188748847763378177;Tendencia positiva;0.696618000236407
jairoroa171;2019-10-28 04:15;0;0;"@ AlvaroUribeVel @ PalomaSenadora @ PaolaHolguin @ CeDemocratico se les vino encima el mundo con la revolucion inteligente de un pueblo que los derroto como debe ser, en las urnas y que demuestra asi que no cree mas en su falacias y que sabe la verdad de su corrupto lider Uribe Velez";;@ AlvaroUribeVel @ PalomaSenadora @ PaolaHolguin @ CeDemocratico;;"1188746052779892737";https://twitter.com/jairoroa171/status/1188746052779892737;Muy negativo;0.0678981412036502
jairoroa171;2019-10-28 04:10;0;0;"@ AlvaroUribeVel @ PalomaSenadora @ PaolaHolguin @ CeDemocratico senador Carlos Felipe Mejia y senores uribistas, Me llena de jubilo y a la gran mayoria de colombianos el despertar del pueblo, que otrora creyo en sus mentiras, Colombia dijo no mas a Uribe Velez ni a su partido cd https ...";;@ AlvaroUribeVel @ PalomaSenadora @ PaolaHolguin @ CeDemocratico;;"1188744926135230465";https://twitter.com/jairoroa171/status/1188744926135230465;Muy negativo;0.008987746766767545
JBH18538294;2019-10-28 04:01;0;0;"Era hora que los colombianos abrieran sus ojos y no votar x un criminal genocida bandido sicario violo hijupta lacra de Alvaro Uribe Velez fuera fuera Uribe paraco el pueblo esta verraco";;;;"1188742592252563456";https://twitter.com/JBH18538294/status/1188742592252563456;Muy negativo;0.0024127961802979003
BohorquezJuli;2019-10-28 02:54;0;7;"Se me metio un "hoy es el comienzo del fin de Alvaro Uribe Velez" en el ojo. https ...";;;;"1188725635310596096";https://twitter.com/BohorquezJuli/status/1188725635310596096;Muy negativo;0.14778982968204113
QUE_VIVA_URIBE;2019-10-28 01:47;0;0;"Que viva el porno que viva Alvaro Uribe Velez que viva el URIBISMO arriba hpta";;;;"1188708899236601856";https://twitter.com/QUE_VIVA_URIBE/status/1188708899236601856;Muy negativo;0.05101159307352725
QUE_VIVA_URIBE;2019-10-28 01:42;0;0;"Hay Dianita el mejor el EXELENTISIMO PRESIDENTE ALVARO URIBE VELEZ HAY HOME SI EL SE LANZARA DE NUEVO A LA PRESIDENCIA DE UNA YA TENDRIA LOS VOTOS NECESARIOS PARA GANAR Y ESTAR DONDE DEBERIA ESTAR AL FRENTE DE ESTE PAIS ENFRENTANDO LAS MALDAD ARRIBA URIBE ARRIBA";;;;"1188707631780843521";https://twitter.com/QUE_VIVA_URIBE/status/1188707631780843521;Neutral;0.0
EnilsonJavier1;2019-10-28 01:32;0;0;"Lo que pasa es que petro quiere gobernar el para pintar los carros de la basura y decir que son nuevos pero como dicen las vallas de Barranquilla estamos con ti Alvaro uribe velez#UribeElGranPerdedor";;;;"1188705152825470976";https://twitter.com/EnilsonJavier1/status/1188705152825470976;Muy negativo;0.018890045184243254
karvajalonso;2019-10-28 01:19;0;0;"Ojala de Silvio Rodriguez "ojala caiga un rayo que te borre por siempre " y hoy cayo ese rayo sobre Alvaro Uribe Velez";;;;"1188701769863438336";https://twitter.com/karvajalonso/status/1188701769863438336;Muy negativo;0.053128356404501274
QUE_VIVA_URIBE;2019-10-28 01:17;0;1;"Arriba ALVARO URIBE VELEZ Y EL # URIBISMO ARRIBA";;;# URIBISMO;"1188701404405350400";https://twitter.com/QUE_VIVA_URIBE/status/1188701404405350400;Neutral;0.0
QUE_VIVA_URIBE;2019-10-28 01:06;0;0;"Ingenuos ustedes manada de idiotas ALVARO URIBE VELEZ el unico que tuvo la valentia de darle plomo a la guerrilla y poner en pie el pais gracias ALVARO URIBE VELEZ usted hacido y sera el unico inigualable el mejor # QUE VIVA EL URIBISMO ARRIBA";;;# QUE;"1188698444879278081";https://twitter.com/QUE_VIVA_URIBE/status/1188698444879278081;Muy negativo;0.050811628210785505
QUE_VIVA_URIBE;2019-10-28 01:02;0;0;"Callese la geta pedaso de mal p ri do baboso estupido ignorante el URIBISMO fue y sera el unico e inigualable GRACIAS el a ALVARO URIBE VELEZ Real Valiente y con los pantalones muy bien puestos para enfrentar la guerrilla y los malandros a plomo hpta el unico # ALVARO URIBE VELEZ";;;# ALVARO;"1188697464334934016";https://twitter.com/QUE_VIVA_URIBE/status/1188697464334934016;Tendencia positiva;0.5704735627745905
daniel_bystereo;2019-10-28 01:01;1;2;"Mi muneco de ano viejo este ano sera de Alvaro Uribe Velez, para dejarlo como ayer: quemado y hecho pedazos # EleccionesColombia2019 # UribeElGranPerdedor";;;# EleccionesColombia2019 # UribeElGranPerdedor;"1188697310752051200";https://twitter.com/daniel_bystereo/status/1188697310752051200;Muy negativo;0.01818834260439994
LauPaezH;2019-10-28 00:54;0;0;"El senor esta hablando de crimenes de lesa humanidad y es seguidor de Alvaro Uribe Velez. Ternurita. https ...";;;;"1188695575530790912";https://twitter.com/LauPaezH/status/1188695575530790912;Muy negativo;0.08016435069153906
Francis30998676;2019-10-28 00:50;0;0;"Hoy colombia se quito una gran maldicion: ALVARO URIBE VELEZ, falta usted.";;;;"1188694530805121025";https://twitter.com/Francis30998676/status/1188694530805121025;Muy negativo;0.18026727580802393
luzmabe1959;2019-10-28 00:44;2;4;"Desde que Uribe Velez nos puso a santos y ahora un presidente que prometio q ni trizas ni risas. Es una burla la que ha hecho a los q votamos x el. Y eligio gente q no tiene un buen perfil sino gente q ha ayudado a q se lo gocen a el y los q votamos x el.Q verguenza y rabia sien";;;;"1188692999028518913";https://twitter.com/luzmabe1959/status/1188692999028518913;Muy negativo;0.00018933718240026338
somoscolombiasc;2019-10-28 00:43;0;0;"Ay ombe, como me dan de tristeza esas personas cuando el propio jefe de campana del NO, Juan Carlos Velez Uribe, revelo en una entrevista que esa campana se baso principalmente en emberracar gente con informacion falsa. ?Sera que debo poner el video? Tus neuronas explotaran.";;;;"1188692818920902656";https://twitter.com/somoscolombiasc/status/1188692818920902656;Muy negativo;0.03671140546367072
EsperanzaBeta16;2019-10-28 00:42;0;3;"Senora Salud usted esta equivocada el senor Alvaro Uribe Velez no era candidato a ninguna alcaldia ni a ninguna gobernacion por lo tanto no perdio manada La que si perdio fue Colombia que cada dia se acerca mas al socialismo encabezado desde la izquierda capitalina https ...";;;;"1188692384508530688";https://twitter.com/EsperanzaBeta16/status/1188692384508530688;Muy negativo;0.007438636177543946
jorgefitness18;2019-10-28 00:26;0;0;"Senor senador alvaro Uribe Velez, perdio por las propuestas en contra del pueblo, el proletariado es la herramienta que hace funcionar la maquinaria de la industria, y usted con esas propuestas que solo favorece A la industria privada.";;;;"1188688535747997696";https://twitter.com/jorgefitness18/status/1188688535747997696;Muy negativo;0.03569342443410241
abajoelcilantro;2019-10-28 00:22;1;1;"Increiblemente, de verdad, que Alvaro Uribe Velez haya tenido mas personalidad, autocritica y gallardia que Gustavo. Mk, ese senor dice que Fajardo existe para estorbar al movimiento alternativo, pero la realidad es que Gustavo entorpece mas, mas que el mismo Uribe o Fajardo.";;;;"1188687476833042432";https://twitter.com/abajoelcilantro/status/1188687476833042432;Muy negativo;0.24471192143263254
DonIzquierdo_;2019-10-28 00:16;1;0;""El comienzo del fin de Alvaro Uribe Velez" "la lucha por la 'democracia' ni tiene fin" pic.twitter.com/6qLghk29du";;;;"1188685890400464898";https://twitter.com/DonIzquierdo_/status/1188685890400464898;Tendencia negativa;0.4046156833713324
flaca65;2019-10-28 00:16;0;0;"Usted es borrego, yo no, yo admiro a quien salvo el pais y dio paz durante ocho anos a Colombia ALVARO URIBE VELEZ, y si NIETO LOAIZA le voltea la espalda a su legado prefiero apoyar otro candidato que sea leal a lo que Uribe siempre a querido un pais en democracia";;;;"1188685841574649857";https://twitter.com/flaca65/status/1188685841574649857;Muy negativo;0.07107281529963676
djdeegarcia;2019-10-28 00:14;0;0;"Rata inmunda setenta Uribe Velez!";;;;"1188685345463951360";https://twitter.com/djdeegarcia/status/1188685345463951360;Neutral;0.0
teleSURColombia;2019-10-28 00:07;3;2;"Video: Reconoce expdte Alvaro Uribe Velez su derrota en el... http # ColombiaDecide # ColombiaQuierePaz # Colombia # PazColombia";;;# ColombiaDecide # ColombiaQuierePaz # Colombia # PazColombia;"1188683735711002629";https://twitter.com/teleSURColombia/status/1188683735711002629;Muy negativo;0.15445194175412288
StellaC38516016;2019-10-28 00:06;0;0;"Por fin esta guaricha reconoce publicamente que ALVARO URIBE VELEZ es el politico mas influyente d la politica colombiana";;;;"1188683386157785088";https://twitter.com/StellaC38516016/status/1188683386157785088;Muy negativo;0.13054105385972053
marianoospina16;2019-10-28 00:04;0;0;"Claudia Lopez =fajardo presidente. Fajardo presidente =uribe Velez";;;;"1188682997207371776";https://twitter.com/marianoospina16/status/1188682997207371776;Muy negativo;0.2712458581045718
cesar_tello;2019-10-28 00:00;0;1;"Senador yo pertenezco a la centro izquierda pero le pido que tiren para el mismo lado, usted con su egocentrismo esta haciendo que mucha gente desista de usted. Usted es muy inteligente pero eso lo esta volviendo como el que tanto criticamos: Uribe Velez.";;;;"1188681998044450816";https://twitter.com/cesar_tello/status/1188681998044450816;Tendencia positiva;0.5498681179964783
marceloctorres;2019-10-28 00:00;0;0;"Miguel Uribe recibio la adhesion del CD cuando se quedo sin un candidato medio representativo, no era SU candidato, pero definitivamente esa adhesion lo estigmatiza como el candidato de Uribe Velez y le quita votos, muchas personas no votaron por el porque por esa sola razon";;;;"1188681899125936128";https://twitter.com/marceloctorres/status/1188681899125936128;Muy negativo;0.010996673248089842
byronaedo;2019-10-27 23:54;4;2;"Aca tiene la obediencia que le tienen los bandiditos de su secta, sr patriarca en otono @ AlvaroUribeVel Gracias por brindarnos esta satisfa  ccion indescriptible y que veiamos lejana Gracias, mil gracias expolitico Uribe Velez ! pic.twitter.com/yCh0ZMr3ww";;@ AlvaroUribeVel;;"1188680517622915073";https://twitter.com/byronaedo/status/1188680517622915073;Muy negativo;0.11395782444780496
sagitarioxx;2019-10-27 23:52;0;0;"Gracias Dr Alvaro Uribe Velez pero parece q para algunos la buena vida cansa y la mala amansa esperemos q El tiempo no nos de la razon como en otros casos";;;;"1188680006295326722";https://twitter.com/sagitarioxx/status/1188680006295326722;Muy negativo;0.034439204328185404
nathanSalas7;2019-10-27 23:52;0;3;"A venderle el cuento de la izquierda y sus fantasmas de campana sucia a su idolo Uribe Velez.";;;;"1188679906303066112";https://twitter.com/nathanSalas7/status/1188679906303066112;Muy negativo;0.13132028762424985
Sammy_Laz;2019-10-27 23:51;0;1;"Por decirle Ex presidente a el senor Alvaro Uribe Velez y no "presidente" fue la hecatombe para los uribistas. De calvo marica para arriba van los indultos.";;;;"1188679665839411200";https://twitter.com/Sammy_Laz/status/1188679665839411200;Muy negativo;0.0015688945357120218
LuisAlb83529403;2019-10-27 23:48;0;0;"G PETRO SI UD SIGUE ASI ESTA IMITANDO A URIBE VELEZ EN SU ACTUAR. QUE TRISTEZA.";;;;"1188678825548357632";https://twitter.com/LuisAlb83529403/status/1188678825548357632;Neutral;0.0
adalvasquez;2019-10-27 23:43;0;1;"El uribismo perdio en: Bogota Cali Medellin Santa Marta Cucuta Manizales Monteria Boyaca Cesar Cordoba Caqueta Esto me devuelve la esperanza en Colombia,hoy es el comienzo del fin de Alvaro Uribe Velez. pic.twitter.com/sD6jTKsyO0";;;;"1188677732969910274";https://twitter.com/adalvasquez/status/1188677732969910274;Muy negativo;0.13478517008568167
LeoBolivar;2019-10-27 23:43;0;1;"  Uribe Velez   Pinera (Una vez mas)   La oposicion Venezolana   La oposicion Latinoamericana   Trump (+1.000.000)   Pompeo, Pence, Rubio   Miguel Bose, Alejandro Sanz, Carlos Vives, Mana, R. Montaner, Juanes, El Puma, Nacho....   Mi vecina escualida   Nojoda, un gentio...";;;;"1188677623599243264";https://twitter.com/LeoBolivar/status/1188677623599243264;Muy negativo;0.030948624489557548
dioniciog10;2019-10-27 23:42;1;0;"El Uribismo perdio en: Bucaramanga Bogota Cali Medellin Santa Marta Cucuta Manizales Monteria Boyaca Cesar Cordoba Caqueta Esto me devuelve la esperanza en Colombia, hoy es el comienzo del fin de Alvaro Uribe Velez. @ NicolasMaduro @ LuisLaRosaVE @ LucyRiveroVe";;@ NicolasMaduro @ LuisLaRosaVE @ LucyRiveroVe;;"1188677408339251201";https://twitter.com/dioniciog10/status/1188677408339251201;Muy negativo;0.020327453827769865
wfabiantorres;2019-10-27 23:40;0;0;"Hasta MEDELLIN se unio a la derrota del uribismo. !Gracias Medallo!... gracias Cali.. Bogota.. Barranquilla Bucaramanga etc..el principio del del fin del clan Uribe Velez";;;;"1188677012287873024";https://twitter.com/wfabiantorres/status/1188677012287873024;Muy negativo;0.008943623068860613
FreddyPosada;2019-10-27 23:40;0;0;"Esa gente que dice, no voten por partido conservador ni nada que tenga que ver con Alvaro Uribe Velez, pero votaron por Elsa noguera y Pumarejo, candidatos que son de Uribe, quien los entiende?";;;;"1188676860827394048";https://twitter.com/FreddyPosada/status/1188676860827394048;Muy negativo;0.0782028312869923
andreszamudiofc;2019-10-27 23:38;0;0;"Pabellon de Quemados del Hospital Simon Bolivar: Alvaro Uribe Velez, Gustavo Petro, Hollman Morris, Miguel Uribe, Josias Fiesco, Jorge Duran Silva. Ayudenme quien mas esta pernoctando esta noche en ese pabellon y poniendose Crema Ndeg 4.";;;;"1188676290393595905";https://twitter.com/andreszamudiofc/status/1188676290393595905;Muy negativo;0.1513189043475011
Ney44336862;2019-10-27 23:35;0;0;"Eduardo Luis estas como tu idolo politico (Uribe Velez) aceptando la derrota, la verdad es que se llevaron una pela en todo el pais. Ah y que mal eligio Cali, es una pena que no aprendemos del pasado.";;;;"1188675578179870720";https://twitter.com/Ney44336862/status/1188675578179870720;Muy negativo;0.16076138152219743
CamilaC37165532;2019-10-27 23:34;0;0;"Despues de todo me siento un poco bien al saber que el pais ya esta despertando, estan dejando de ser tan estupidos creyendo toda la basura que les dice Alvaro Uribe Velez, es lindo saber que ya el fin de Uribe llego. https ...";;;;"1188675422067810304";https://twitter.com/CamilaC37165532/status/1188675422067810304;Muy negativo;0.160863699395872
erazoricardo3;2019-10-27 23:28;0;0;"BOGOTA DC, esta saliendo de la CLOACA SOCIAL, economico, educativo, cultural, que por decades vivio, usted escribe " modales " MASIAS, uribe velez, paloma " valencia " y tantos otros corruptos politicos, cree usted que son ejemplo de EDUCACION " modales "ella lo hara muy";;;;"1188673974588362752";https://twitter.com/erazoricardo3/status/1188673974588362752;Muy negativo;0.2312349556699519
SantosTuto;2019-10-27 23:27;1;2;"Cuatro grandes perdedores en las elecciones de hoy en Colombia: 1. Uribe Velez 2. Las firmas encuestadoras 3. El presidente Duque 4. Las iglesias cristianas.";;;;"1188673736746119169";https://twitter.com/SantosTuto/status/1188673736746119169;Muy negativo;0.025258566793518646
DiegoFigueroaVa;2019-10-27 23:26;0;0;"Quiero ver al Uribismo en pleno rechazando estos actos de vandalismo y la agresion a los policias. @ PalomaValenciaL @ MariaFdaCabal @ PaolaHolguin Carlos Felipe Mejia, Alvaro Uribe Velez y todos los demas. Quedo atento. https ...";;@ PalomaValenciaL @ MariaFdaCabal @ PaolaHolguin;;"1188673490943205377";https://twitter.com/DiegoFigueroaVa/status/1188673490943205377;Muy negativo;0.02349376820823869
SAlarcn10;2019-10-27 23:24;1;3;"Pense que Colombia no se uniria a la primavera latinoamericana, pareciamos dormitar comodamente bajo el yugo del patron (Uribe Velez), con estas elecciones parece que empezamos a bostezar antes de despertar.";;;;"1188672876863512576";https://twitter.com/SAlarcn10/status/1188672876863512576;Muy negativo;0.12189002614966833
josedgomez_;2019-10-27 23:22;0;0;"Esto lo llega a hacer Uribe Velez, Alvaro y aca estarian armando un drama. https ...";;;;"1188672460926914560";https://twitter.com/josedgomez_/status/1188672460926914560;Tendencia negativa;0.39776131543983917
Francis30998676;2019-10-27 23:20;0;0;"Colombia, se quito una maldicion hoy: a su patron ALVARO URIBE VELEZ, falta usted";;;;"1188671968385650688";https://twitter.com/Francis30998676/status/1188671968385650688;Muy negativo;0.06499277229779794
juangabauditor;2019-10-27 23:18;0;0;"Yo creo que Alvaro Uribe Velez el Paraco No es el gran perdedor de esta jornada diria que el gran perdedor es el marrano de Duque... la gente esta tan arrepentida de haber elegido una bestia de esas... que esta vez no votaron por el que les dijo el paraco!";;;;"1188671397754785793";https://twitter.com/juangabauditor/status/1188671397754785793;Muy negativo;0.002557946224452591
reyunico1;2019-10-27 23:16;3;5;"Una sola forma, la era de terror del paramilitar Alvaro Uribe Velez, se comienza a diluir.";;;;"1188670837471305729";https://twitter.com/reyunico1/status/1188670837471305729;Muy negativo;0.04852014215689022
j_ortegabuelvas;2019-10-27 23:09;0;2;"Somos la generacion del cambio, la que odia a Alvaro Uribe Velez";;;;"1188669021123682306";https://twitter.com/j_ortegabuelvas/status/1188669021123682306;Muy negativo;0.1989056034550009
Yojuansantana;2019-10-27 23:06;0;1;"Muchos exitos y bendiciones ahora me doy de cuenta que si se puede apoyar a alguien cristiano fuera de la cobertura de Uribe Velez... Mi apoyo total para usted asi no pertenezca a su misma iglesia";;;;"1188668400370966535";https://twitter.com/Yojuansantana/status/1188668400370966535;Muy negativo;0.09521820467931116
AndyDiazP;2019-10-27 23:06;0;0;"Alvaro Uribe Velez";;;;"1188668247576584193";https://twitter.com/AndyDiazP/status/1188668247576584193;Neutral;0.0
bugsbunny2390;2019-10-27 23:05;4;0;"LLevo usted las instituciones de un pais, a la degradacion de otro grupo criminal mas.asesino miles de inocentes en venganza por la muerte de su delincuente padre.Uribe Velez, una completa familia de criminales. AGARRE SUS CROCS Y EMPIECE A CORRER...la extradicion lo espera pic.twitter.com/qPJj1C7zx8";;;;"1188668196359938052";https://twitter.com/bugsbunny2390/status/1188668196359938052;Muy negativo;0.007069890637037339
DiegoVelezGar;2019-10-27 22:57;3;26;"Que bueno que hable de Uribe sin nombrar a Petro. Ataque por separado, que no son harina del mismo costal. https ...";;;;"1188666193764331520";https://twitter.com/DiegoVelezGar/status/1188666193764331520;Muy negativo;0.11756952511487033
pautorrado;2019-10-27 22:56;0;2;"La semana tortusa, desgastante aburridora y frustrada que tuve no se compara en nada con la mala noche que deben estar pasando Uribe Velez y Ramiro Suarez. Cucuta querida de mi corazon como te quiero. Gracias viejito @ ingjairoyanez";;@ ingjairoyanez;;"1188665768734531584";https://twitter.com/pautorrado/status/1188665768734531584;Muy negativo;0.07205337386928201
AngieOchoaNava1;2019-10-27 22:55;0;2;"No sigo a Alvaro Uribe Velez solo lo busque para darle un me gusta su reconocimiento por su derrota hoy en Colombia , es lo minimo que puedo hacer";;;;"1188665458452361217";https://twitter.com/AngieOchoaNava1/status/1188665458452361217;Muy negativo;0.16447472451443945
RojasCristian0;2019-10-27 22:53;0;0;"Les presento a Alvaro Uribe Velez en cualquier lugar que se presenta...";;;;"1188665127031246848";https://twitter.com/RojasCristian0/status/1188665127031246848;Tendencia negativa;0.3360405433461142
CarlosEParedes2;2019-10-27 22:52;3;29;"Juan Carlos Velez Uribe, porque fue el estratega del no en el plebiscito. Se merece su quemada.";;;;"1188664848571424769";https://twitter.com/CarlosEParedes2/status/1188664848571424769;Muy negativo;0.18643841223358512
Francis30998676;2019-10-27 22:50;0;0;"Colombia hoy 27 de octubre, se quito una gran maldicion: ALVARO URIBE VELEZ, EL COCO DE LOS POBRES.";;;;"1188664231283036160";https://twitter.com/Francis30998676/status/1188664231283036160;Muy negativo;0.12310251228252571
Francis30998676;2019-10-27 22:47;0;0;"@ PalomaSenadora colombia, hoy 27 de octubre se quito una gran maldicion: ALVARO URIBE VELEZ, EL COCO DE LOS POBRES.";;@ PalomaSenadora;;"1188663595929919489";https://twitter.com/Francis30998676/status/1188663595929919489;Muy negativo;0.12310251228252571
JuanDLCruzLuque;2019-10-27 22:46;1;1;"Quisiera estar en la etapa de superacion en la que esta Selena, pero no, estoy en la de tristeza y despecho en la que esta Uribe Velez en estos momentos";;;;"1188663239472607232";https://twitter.com/JuanDLCruzLuque/status/1188663239472607232;Tendencia negativa;0.43830918551513476
Francis30998676;2019-10-27 22:45;0;0;"La verdad, colombia se quito una gran maldicio n: ALVARO URIBE VELEZ, EL COCO DE LOS POBRES, PARTE4";;;;"1188663004780474369";https://twitter.com/Francis30998676/status/1188663004780474369;Tendencia negativa;0.32442100473153745
Virgini60399849;2019-10-27 22:44;0;1;"Le debe dar verguenza a este guerrillero referirse de paraco a un hombre intachable como lo es Alvaro Uribe Velez. Definitivamente el ladron juzga por su condicion.";;;;"1188662764237135873";https://twitter.com/Virgini60399849/status/1188662764237135873;Muy negativo;0.012005004265249728
margotam13;2019-10-27 22:44;0;0;"Tienes razon son dos bestias distintas pero a quien si se parece alvaro uribe velez es a jorge 40 no cree senor araujo?";;;;"1188662711493758976";https://twitter.com/margotam13/status/1188662711493758976;Muy negativo;0.125854578929644
TatianaCastro__;2019-10-27 22:43;0;0;"No te lo puedo creer, que tristeza tan Alvaro Uribe Velez pic.twitter.com/6b7jqemNXA";;;;"1188662650596712448";https://twitter.com/TatianaCastro__/status/1188662650596712448;Muy negativo;0.1359169636933136
